root@lamp-ubuntu-s-1vcpu-1gb-tor1-01:~# tcpdump -n -i eth0
tcpdump: verbose output suppressed, use -v[v]... for full protocol decode
listening on eth0, link-type EN10MB (Ethernet), snapshot length 262144 bytes
20:45:34.320738 IP 178.128.234.189.22 > 162.243.188.66.27289: Flags [P.], seq 2175826107:2175826235, ack 2913648189, win 501, options [nop,nop,TS val 1182950162 ecr 612707123], length 128
20:45:34.320808 IP 178.128.234.189.22 > 162.243.188.66.27289: Flags [P.], seq 128:192, ack 1, win 501, options [nop,nop,TS val 1182950162 ecr 612707123], length 64
20:45:34.320861 IP 178.128.234.189.22 > 162.243.188.66.27289: Flags [P.], seq 192:272, ack 1, win 501, options [nop,nop,TS val 1182950162 ecr 612707123], length 80
20:45:34.320908 IP 178.128.234.189.22 > 162.243.188.66.27289: Flags [P.], seq 272:352, ack 1, win 501, options [nop,nop,TS val 1182950162 ecr 612707123], length 80
20:45:34.320955 IP 178.128.234.189.22 > 162.243.188.66.27289: Flags [P.], seq 352:432, ack 1, win 501, options [nop,nop,TS val 1182950162 ecr 612707123], length 80
20:45:34.320997 IP 178.128.234.189.22 > 162.243.188.66.27289: Flags [P.], seq 432:496, ack 1, win 501, options [nop,nop,TS val 1182950162 ecr 612707123], length 64
20:45:34.331363 IP 162.243.188.66.27289 > 178.128.234.189.22: Flags [.], ack 0, win 4768, options [nop,nop,TS val 612707140 ecr 1182950159], length 0
20:45:34.333882 IP 162.243.188.66.27289 > 178.128.234.189.22: Flags [.], ack 128, win 4768, options [nop,nop,TS val 612707143 ecr 1182950162], length 0
20:45:34.333882 IP 162.243.188.66.27289 > 178.128.234.189.22: Flags [.], ack 192, win 4768, options [nop,nop,TS val 612707143 ecr 1182950162], length 0
20:45:34.333882 IP 162.243.188.66.27289 > 178.128.234.189.22: Flags [.], ack 272, win 4768, options [nop,nop,TS val 612707143 ecr 1182950162], length 0
20:45:34.333993 IP 162.243.188.66.27289 > 178.128.234.189.22: Flags [.], ack 352, win 4768, options [nop,nop,TS val 612707143 ecr 1182950162], length 0
20:45:34.333993 IP 162.243.188.66.27289 > 178.128.234.189.22: Flags [.], ack 432, win 4768, options [nop,nop,TS val 612707143 ecr 1182950162], length 0
20:45:34.334061 IP 162.243.188.66.27289 > 178.128.234.189.22: Flags [.], ack 496, win 4768, options [nop,nop,TS val 612707143 ecr 1182950162], length 0
20:45:34.422114 IP 178.128.234.189.22 > 162.243.188.66.27289: Flags [P.], seq 496:736, ack 1, win 501, options [nop,nop,TS val 1182950263 ecr 612707143], length 240
20:45:34.422274 IP 178.128.234.189.22 > 162.243.188.66.27289: Flags [P.], seq 736:1024, ack 1, win 501, options [nop,nop,TS val 1182950263 ecr 612707143], length 288
20:45:34.422356 IP 178.128.234.189.22 > 162.243.188.66.27289: Flags [P.], seq 1024:1088, ack 1, win 501, options [nop,nop,TS val 1182950263 ecr 612707143], length 64
20:45:34.422378 IP 178.128.234.189.22 > 162.243.188.66.27289: Flags [P.], seq 1088:1312, ack 1, win 501, options [nop,nop,TS val 1182950263 ecr 612707143], length 224
20:45:34.422420 IP 178.128.234.189.22 > 162.243.188.66.27289: Flags [P.], seq 1312:1376, ack 1, win 501, options [nop,nop,TS val 1182950263 ecr 612707143], length 64
20:45:34.422464 IP 178.128.234.189.22 > 162.243.188.66.27289: Flags [P.], seq 1376:1600, ack 1, win 501, options [nop,nop,TS val 1182950263 ecr 612707143], length 224
20:45:34.422508 IP 178.128.234.189.22 > 162.243.188.66.27289: Flags [P.], seq 1600:1664, ack 1, win 501, options [nop,nop,TS val 1182950263 ecr 612707143], length 64
20:45:34.422563 IP 178.128.234.189.22 > 162.243.188.66.27289: Flags [P.], seq 1664:1888, ack 1, win 501, options [nop,nop,TS val 1182950263 ecr 612707143], length 224
20:45:34.422594 IP 178.128.234.189.22 > 162.243.188.66.27289: Flags [P.], seq 1888:1952, ack 1, win 501, options [nop,nop,TS val 1182950263 ecr 612707143], length 64
20:45:34.422633 IP 178.128.234.189.22 > 162.243.188.66.27289: Flags [P.], seq 1952:2176, ack 1, win 501, options [nop,nop,TS val 1182950263 ecr 612707143], length 224
20:45:34.422712 IP 178.128.234.189.22 > 162.243.188.66.27289: Flags [P.], seq 2176:2448, ack 1, win 501, options [nop,nop,TS val 1182950264 ecr 612707143], length 272
20:45:34.422878 IP 178.128.234.189.22 > 162.243.188.66.27289: Flags [P.], seq 2448:3056, ack 1, win 501, options [nop,nop,TS val 1182950264 ecr 612707143], length 608
20:45:34.423026 IP 178.128.234.189.22 > 162.243.188.66.27289: Flags [P.], seq 3056:3808, ack 1, win 501, options [nop,nop,TS val 1182950264 ecr 612707143], length 752
20:45:34.423104 IP 178.128.234.189.22 > 162.243.188.66.27289: Flags [P.], seq 3808:4080, ack 1, win 501, options [nop,nop,TS val 1182950264 ecr 612707143], length 272
20:45:34.435328 IP 162.243.188.66.27289 > 178.128.234.189.22: Flags [.], ack 736, win 4768, options [nop,nop,TS val 612707244 ecr 1182950263], length 0
20:45:34.435329 IP 162.243.188.66.27289 > 178.128.234.189.22: Flags [.], ack 1024, win 4768, options [nop,nop,TS val 612707244 ecr 1182950263], length 0
20:45:34.435387 IP 178.128.234.189.22 > 162.243.188.66.27289: Flags [P.], seq 4080:4144, ack 1, win 501, options [nop,nop,TS val 1182950276 ecr 612707244], length 64
20:45:34.435582 IP 162.243.188.66.27289 > 178.128.234.189.22: Flags [.], ack 1088, win 4768, options [nop,nop,TS val 612707244 ecr 1182950263], length 0
20:45:34.435582 IP 162.243.188.66.27289 > 178.128.234.189.22: Flags [.], ack 1312, win 4768, options [nop,nop,TS val 612707244 ecr 1182950263], length 0
20:45:34.435582 IP 162.243.188.66.27289 > 178.128.234.189.22: Flags [.], ack 1376, win 4768, options [nop,nop,TS val 612707244 ecr 1182950263], length 0
20:45:34.435582 IP 162.243.188.66.27289 > 178.128.234.189.22: Flags [.], ack 1600, win 4768, options [nop,nop,TS val 612707244 ecr 1182950263], length 0
20:45:34.435583 IP 162.243.188.66.27289 > 178.128.234.189.22: Flags [.], ack 1664, win 4768, options [nop,nop,TS val 612707244 ecr 1182950263], length 0
20:45:34.435615 IP 162.243.188.66.27289 > 178.128.234.189.22: Flags [.], ack 1888, win 4768, options [nop,nop,TS val 612707244 ecr 1182950263], length 0
20:45:34.435615 IP 162.243.188.66.27289 > 178.128.234.189.22: Flags [.], ack 1952, win 4768, options [nop,nop,TS val 612707244 ecr 1182950263], length 0
20:45:34.436003 IP 162.243.188.66.27289 > 178.128.234.189.22: Flags [.], ack 3808, win 4768, options [nop,nop,TS val 612707245 ecr 1182950263], length 0
20:45:34.468405 IP 162.243.188.66.27289 > 178.128.234.189.22: Flags [.], ack 4144, win 4768, options [nop,nop,TS val 612707277 ecr 1182950264], length 0
20:45:34.526010 IP 178.128.234.189.22 > 162.243.188.66.27289: Flags [P.], seq 4144:4368, ack 1, win 501, options [nop,nop,TS val 1182950367 ecr 612707277], length 224
20:45:34.526096 IP 178.128.234.189.22 > 162.243.188.66.27289: Flags [P.], seq 4368:4656, ack 1, win 501, options [nop,nop,TS val 1182950367 ecr 612707277], length 288
20:45:34.526212 IP 178.128.234.189.22 > 162.243.188.66.27289: Flags [P.], seq 4656:5008, ack 1, win 501, options [nop,nop,TS val 1182950367 ecr 612707277], length 352
20:45:34.526271 IP 178.128.234.189.22 > 162.243.188.66.27289: Flags [P.], seq 5008:5520, ack 1, win 501, options [nop,nop,TS val 1182950367 ecr 612707277], length 512
20:45:34.526365 IP 178.128.234.189.22 > 162.243.188.66.27289: Flags [P.], seq 5520:6096, ack 1, win 501, options [nop,nop,TS val 1182950367 ecr 612707277], length 576
20:45:34.526413 IP 178.128.234.189.22 > 162.243.188.66.27289: Flags [P.], seq 6096:6160, ack 1, win 501, options [nop,nop,TS val 1182950367 ecr 612707277], length 64
20:45:34.526473 IP 178.128.234.189.22 > 162.243.188.66.27289: Flags [P.], seq 6160:6384, ack 1, win 501, options [nop,nop,TS val 1182950367 ecr 612707277], length 224
20:45:34.526576 IP 178.128.234.189.22 > 162.243.188.66.27289: Flags [P.], seq 6384:6736, ack 1, win 501, options [nop,nop,TS val 1182950367 ecr 612707277], length 352
20:45:34.526640 IP 178.128.234.189.22 > 162.243.188.66.27289: Flags [P.], seq 6736:6960, ack 1, win 501, options [nop,nop,TS val 1182950367 ecr 612707277], length 224
20:45:34.526669 IP 178.128.234.189.22 > 162.243.188.66.27289: Flags [P.], seq 6960:7024, ack 1, win 501, options [nop,nop,TS val 1182950367 ecr 612707277], length 64
20:45:34.526709 IP 178.128.234.189.22 > 162.243.188.66.27289: Flags [P.], seq 7024:7248, ack 1, win 501, options [nop,nop,TS val 1182950368 ecr 612707277], length 224
20:45:34.526750 IP 178.128.234.189.22 > 162.243.188.66.27289: Flags [P.], seq 7248:7312, ack 1, win 501, options [nop,nop,TS val 1182950368 ecr 612707277], length 64
20:45:34.526804 IP 178.128.234.189.22 > 162.243.188.66.27289: Flags [P.], seq 7312:7536, ack 1, win 501, options [nop,nop,TS val 1182950368 ecr 612707277], length 224
20:45:34.526835 IP 178.128.234.189.22 > 162.243.188.66.27289: Flags [P.], seq 7536:7600, ack 1, win 501, options [nop,nop,TS val 1182950368 ecr 612707277], length 64
20:45:34.526874 IP 178.128.234.189.22 > 162.243.188.66.27289: Flags [P.], seq 7600:7824, ack 1, win 501, options [nop,nop,TS val 1182950368 ecr 612707277], length 224
20:45:34.526902 IP 178.128.234.189.22 > 162.243.188.66.27289: Flags [P.], seq 7824:7888, ack 1, win 501, options [nop,nop,TS val 1182950368 ecr 612707277], length 64
20:45:34.526940 IP 178.128.234.189.22 > 162.243.188.66.27289: Flags [P.], seq 7888:8112, ack 1, win 501, options [nop,nop,TS val 1182950368 ecr 612707277], length 224
20:45:34.526968 IP 178.128.234.189.22 > 162.243.188.66.27289: Flags [P.], seq 8112:8176, ack 1, win 501, options [nop,nop,TS val 1182950368 ecr 612707277], length 64
20:45:34.527005 IP 178.128.234.189.22 > 162.243.188.66.27289: Flags [P.], seq 8176:8384, ack 1, win 501, options [nop,nop,TS val 1182950368 ecr 612707277], length 208
20:45:34.527033 IP 178.128.234.189.22 > 162.243.188.66.27289: Flags [P.], seq 8384:8448, ack 1, win 501, options [nop,nop,TS val 1182950368 ecr 612707277], length 64
20:45:34.527069 IP 178.128.234.189.22 > 162.243.188.66.27289: Flags [P.], seq 8448:8656, ack 1, win 501, options [nop,nop,TS val 1182950368 ecr 612707277], length 208
20:45:34.527095 IP 178.128.234.189.22 > 162.243.188.66.27289: Flags [P.], seq 8656:8720, ack 1, win 501, options [nop,nop,TS val 1182950368 ecr 612707277], length 64
20:45:34.527141 IP 178.128.234.189.22 > 162.243.188.66.27289: Flags [P.], seq 8720:8944, ack 1, win 501, options [nop,nop,TS val 1182950368 ecr 612707277], length 224
20:45:34.527207 IP 178.128.234.189.22 > 162.243.188.66.27289: Flags [P.], seq 8944:9008, ack 1, win 501, options [nop,nop,TS val 1182950368 ecr 612707277], length 64
20:45:34.527249 IP 178.128.234.189.22 > 162.243.188.66.27289: Flags [P.], seq 9008:9216, ack 1, win 501, options [nop,nop,TS val 1182950368 ecr 612707277], length 208
20:45:34.527276 IP 178.128.234.189.22 > 162.243.188.66.27289: Flags [P.], seq 9216:9280, ack 1, win 501, options [nop,nop,TS val 1182950368 ecr 612707277], length 64
20:45:34.527313 IP 178.128.234.189.22 > 162.243.188.66.27289: Flags [P.], seq 9280:9488, ack 1, win 501, options [nop,nop,TS val 1182950368 ecr 612707277], length 208
20:45:34.527343 IP 178.128.234.189.22 > 162.243.188.66.27289: Flags [P.], seq 9488:9552, ack 1, win 501, options [nop,nop,TS val 1182950368 ecr 612707277], length 64
20:45:34.527379 IP 178.128.234.189.22 > 162.243.188.66.27289: Flags [P.], seq 9552:9760, ack 1, win 501, options [nop,nop,TS val 1182950368 ecr 612707277], length 208
20:45:34.539427 IP 162.243.188.66.27289 > 178.128.234.189.22: Flags [.], ack 6096, win 4768, options [nop,nop,TS val 612707348 ecr 1182950367], length 0
20:45:34.539481 IP 178.128.234.189.22 > 162.243.188.66.27289: Flags [P.], seq 9760:11456, ack 1, win 501, options [nop,nop,TS val 1182950380 ecr 612707348], length 1696
20:45:34.539836 IP 162.243.188.66.27289 > 178.128.234.189.22: Flags [.], ack 7600, win 4768, options [nop,nop,TS val 612707349 ecr 1182950367], length 0
20:45:34.540349 IP 162.243.188.66.27289 > 178.128.234.189.22: Flags [.], ack 9216, win 4768, options [nop,nop,TS val 612707349 ecr 1182950368], length 0
20:45:34.552682 IP 162.243.188.66.27289 > 178.128.234.189.22: Flags [.], ack 11456, win 4768, options [nop,nop,TS val 612707361 ecr 1182950368], length 0
20:45:34.629972 IP 178.128.234.189.22 > 162.243.188.66.27289: Flags [P.], seq 11456:11680, ack 1, win 501, options [nop,nop,TS val 1182950471 ecr 612707361], length 224
20:45:34.630053 IP 178.128.234.189.22 > 162.243.188.66.27289: Flags [P.], seq 11680:11968, ack 1, win 501, options [nop,nop,TS val 1182950471 ecr 612707361], length 288
20:45:34.630195 IP 178.128.234.189.22 > 162.243.188.66.27289: Flags [P.], seq 11968:12896, ack 1, win 501, options [nop,nop,TS val 1182950471 ecr 612707361], length 928
20:45:34.630236 IP 178.128.234.189.22 > 162.243.188.66.27289: Flags [P.], seq 12896:13120, ack 1, win 501, options [nop,nop,TS val 1182950471 ecr 612707361], length 224
20:45:34.630264 IP 178.128.234.189.22 > 162.243.188.66.27289: Flags [P.], seq 13120:13184, ack 1, win 501, options [nop,nop,TS val 1182950471 ecr 612707361], length 64
20:45:34.630305 IP 178.128.234.189.22 > 162.243.188.66.27289: Flags [P.], seq 13184:13408, ack 1, win 501, options [nop,nop,TS val 1182950471 ecr 612707361], length 224
20:45:34.630332 IP 178.128.234.189.22 > 162.243.188.66.27289: Flags [P.], seq 13408:13472, ack 1, win 501, options [nop,nop,TS val 1182950471 ecr 612707361], length 64
20:45:34.630370 IP 178.128.234.189.22 > 162.243.188.66.27289: Flags [P.], seq 13472:13696, ack 1, win 501, options [nop,nop,TS val 1182950471 ecr 612707361], length 224
20:45:34.630398 IP 178.128.234.189.22 > 162.243.188.66.27289: Flags [P.], seq 13696:13760, ack 1, win 501, options [nop,nop,TS val 1182950471 ecr 612707361], length 64
20:45:34.630434 IP 178.128.234.189.22 > 162.243.188.66.27289: Flags [P.], seq 13760:13984, ack 1, win 501, options [nop,nop,TS val 1182950471 ecr 612707361], length 224
20:45:34.630465 IP 178.128.234.189.22 > 162.243.188.66.27289: Flags [P.], seq 13984:14048, ack 1, win 501, options [nop,nop,TS val 1182950471 ecr 612707361], length 64
20:45:34.630503 IP 178.128.234.189.22 > 162.243.188.66.27289: Flags [P.], seq 14048:14272, ack 1, win 501, options [nop,nop,TS val 1182950471 ecr 612707361], length 224
20:45:34.630546 IP 178.128.234.189.22 > 162.243.188.66.27289: Flags [P.], seq 14272:14336, ack 1, win 501, options [nop,nop,TS val 1182950471 ecr 612707361], length 64
20:45:34.630601 IP 178.128.234.189.22 > 162.243.188.66.27289: Flags [P.], seq 14336:14560, ack 1, win 501, options [nop,nop,TS val 1182950471 ecr 612707361], length 224
20:45:34.630629 IP 178.128.234.189.22 > 162.243.188.66.27289: Flags [P.], seq 14560:14624, ack 1, win 501, options [nop,nop,TS val 1182950471 ecr 612707361], length 64
20:45:34.630684 IP 178.128.234.189.22 > 162.243.188.66.27289: Flags [P.], seq 14624:14848, ack 1, win 501, options [nop,nop,TS val 1182950471 ecr 612707361], length 224
20:45:34.630726 IP 178.128.234.189.22 > 162.243.188.66.27289: Flags [P.], seq 14848:14912, ack 1, win 501, options [nop,nop,TS val 1182950472 ecr 612707361], length 64
20:45:34.630773 IP 178.128.234.189.22 > 162.243.188.66.27289: Flags [P.], seq 14912:15136, ack 1, win 501, options [nop,nop,TS val 1182950472 ecr 612707361], length 224
20:45:34.630801 IP 178.128.234.189.22 > 162.243.188.66.27289: Flags [P.], seq 15136:15200, ack 1, win 501, options [nop,nop,TS val 1182950472 ecr 612707361], length 64
20:45:34.630839 IP 178.128.234.189.22 > 162.243.188.66.27289: Flags [P.], seq 15200:15424, ack 1, win 501, options [nop,nop,TS val 1182950472 ecr 612707361], length 224
20:45:34.630867 IP 178.128.234.189.22 > 162.243.188.66.27289: Flags [P.], seq 15424:15488, ack 1, win 501, options [nop,nop,TS val 1182950472 ecr 612707361], length 64
20:45:34.630903 IP 178.128.234.189.22 > 162.243.188.66.27289: Flags [P.], seq 15488:15712, ack 1, win 501, options [nop,nop,TS val 1182950472 ecr 612707361], length 224
20:45:34.630953 IP 178.128.234.189.22 > 162.243.188.66.27289: Flags [P.], seq 15712:16000, ack 1, win 501, options [nop,nop,TS val 1182950472 ecr 612707361], length 288
20:45:34.630975 IP 178.128.234.189.22 > 162.243.188.66.27289: Flags [P.], seq 16000:16064, ack 1, win 501, options [nop,nop,TS val 1182950472 ecr 612707361], length 64
20:45:34.631014 IP 178.128.234.189.22 > 162.243.188.66.27289: Flags [P.], seq 16064:16288, ack 1, win 501, options [nop,nop,TS val 1182950472 ecr 612707361], length 224
20:45:34.631042 IP 178.128.234.189.22 > 162.243.188.66.27289: Flags [P.], seq 16288:16352, ack 1, win 501, options [nop,nop,TS val 1182950472 ecr 612707361], length 64
20:45:34.631078 IP 178.128.234.189.22 > 162.243.188.66.27289: Flags [P.], seq 16352:16576, ack 1, win 501, options [nop,nop,TS val 1182950472 ecr 612707361], length 224
20:45:34.631105 IP 178.128.234.189.22 > 162.243.188.66.27289: Flags [P.], seq 16576:16640, ack 1, win 501, options [nop,nop,TS val 1182950472 ecr 612707361], length 64
20:45:34.631143 IP 178.128.234.189.22 > 162.243.188.66.27289: Flags [P.], seq 16640:16864, ack 1, win 501, options [nop,nop,TS val 1182950472 ecr 612707361], length 224
20:45:34.631169 IP 178.128.234.189.22 > 162.243.188.66.27289: Flags [P.], seq 16864:16928, ack 1, win 501, options [nop,nop,TS val 1182950472 ecr 612707361], length 64
20:45:34.631207 IP 178.128.234.189.22 > 162.243.188.66.27289: Flags [P.], seq 16928:17152, ack 1, win 501, options [nop,nop,TS val 1182950472 ecr 612707361], length 224
20:45:34.631258 IP 178.128.234.189.22 > 162.243.188.66.27289: Flags [P.], seq 17152:17440, ack 1, win 501, options [nop,nop,TS val 1182950472 ecr 612707361], length 288
20:45:34.631407 IP 178.128.234.189.22 > 162.243.188.66.27289: Flags [P.], seq 17440:18368, ack 1, win 501, options [nop,nop,TS val 1182950472 ecr 612707361], length 928
20:45:34.631455 IP 178.128.234.189.22 > 162.243.188.66.27289: Flags [P.], seq 18368:18592, ack 1, win 501, options [nop,nop,TS val 1182950472 ecr 612707361], length 224
20:45:34.631481 IP 178.128.234.189.22 > 162.243.188.66.27289: Flags [P.], seq 18592:18656, ack 1, win 501, options [nop,nop,TS val 1182950472 ecr 612707361], length 64
20:45:34.631518 IP 178.128.234.189.22 > 162.243.188.66.27289: Flags [P.], seq 18656:18880, ack 1, win 501, options [nop,nop,TS val 1182950472 ecr 612707361], length 224
20:45:34.631545 IP 178.128.234.189.22 > 162.243.188.66.27289: Flags [P.], seq 18880:18944, ack 1, win 501, options [nop,nop,TS val 1182950472 ecr 612707361], length 64
20:45:34.631581 IP 178.128.234.189.22 > 162.243.188.66.27289: Flags [P.], seq 18944:19168, ack 1, win 501, options [nop,nop,TS val 1182950472 ecr 612707361], length 224
20:45:34.631696 IP 178.128.234.189.22 > 162.243.188.66.27289: Flags [P.], seq 19168:19808, ack 1, win 501, options [nop,nop,TS val 1182950472 ecr 612707361], length 640
20:45:34.631720 IP 178.128.234.189.22 > 162.243.188.66.27289: Flags [P.], seq 19808:20016, ack 1, win 501, options [nop,nop,TS val 1182950473 ecr 612707361], length 208
20:45:34.631747 IP 178.128.234.189.22 > 162.243.188.66.27289: Flags [P.], seq 20016:20080, ack 1, win 501, options [nop,nop,TS val 1182950473 ecr 612707361], length 64
20:45:34.631784 IP 178.128.234.189.22 > 162.243.188.66.27289: Flags [P.], seq 20080:20304, ack 1, win 501, options [nop,nop,TS val 1182950473 ecr 612707361], length 224
20:45:34.631812 IP 178.128.234.189.22 > 162.243.188.66.27289: Flags [P.], seq 20304:20368, ack 1, win 501, options [nop,nop,TS val 1182950473 ecr 612707361], length 64
20:45:34.631848 IP 178.128.234.189.22 > 162.243.188.66.27289: Flags [P.], seq 20368:20576, ack 1, win 501, options [nop,nop,TS val 1182950473 ecr 612707361], length 208
20:45:34.631875 IP 178.128.234.189.22 > 162.243.188.66.27289: Flags [P.], seq 20576:20640, ack 1, win 501, options [nop,nop,TS val 1182950473 ecr 612707361], length 64
20:45:34.631910 IP 178.128.234.189.22 > 162.243.188.66.27289: Flags [P.], seq 20640:20848, ack 1, win 501, options [nop,nop,TS val 1182950473 ecr 612707361], length 208
20:45:34.631936 IP 178.128.234.189.22 > 162.243.188.66.27289: Flags [P.], seq 20848:20912, ack 1, win 501, options [nop,nop,TS val 1182950473 ecr 612707361], length 64
20:45:34.631971 IP 178.128.234.189.22 > 162.243.188.66.27289: Flags [P.], seq 20912:21120, ack 1, win 501, options [nop,nop,TS val 1182950473 ecr 612707361], length 208
20:45:34.631999 IP 178.128.234.189.22 > 162.243.188.66.27289: Flags [P.], seq 21120:21184, ack 1, win 501, options [nop,nop,TS val 1182950473 ecr 612707361], length 64
20:45:34.643259 IP 162.243.188.66.27289 > 178.128.234.189.22: Flags [.], ack 13120, win 4768, options [nop,nop,TS val 612707452 ecr 1182950471], length 0
20:45:34.643596 IP 162.243.188.66.27289 > 178.128.234.189.22: Flags [.], ack 14624, win 4768, options [nop,nop,TS val 612707452 ecr 1182950471], length 0
20:45:34.643948 IP 162.243.188.66.27289 > 178.128.234.189.22: Flags [.], ack 16288, win 4768, options [nop,nop,TS val 612707453 ecr 1182950471], length 0
20:45:34.644380 IP 162.243.188.66.27289 > 178.128.234.189.22: Flags [.], ack 18368, win 4768, options [nop,nop,TS val 612707453 ecr 1182950472], length 0
20:45:34.644651 IP 162.243.188.66.27289 > 178.128.234.189.22: Flags [.], ack 20016, win 4768, options [nop,nop,TS val 612707453 ecr 1182950472], length 0
20:45:34.676884 IP 162.243.188.66.27289 > 178.128.234.189.22: Flags [.], ack 21184, win 4768, options [nop,nop,TS val 612707486 ecr 1182950473], length 0
20:45:34.733986 IP 178.128.234.189.22 > 162.243.188.66.27289: Flags [P.], seq 21184:21408, ack 1, win 501, options [nop,nop,TS val 1182950575 ecr 612707486], length 224
20:45:34.734082 IP 178.128.234.189.22 > 162.243.188.66.27289: Flags [P.], seq 21408:21696, ack 1, win 501, options [nop,nop,TS val 1182950575 ecr 612707486], length 288
20:45:34.734225 IP 178.128.234.189.22 > 162.243.188.66.27289: Flags [P.], seq 21696:22336, ack 1, win 501, options [nop,nop,TS val 1182950575 ecr 612707486], length 640
20:45:34.734269 IP 178.128.234.189.22 > 162.243.188.66.27289: Flags [P.], seq 22336:22560, ack 1, win 501, options [nop,nop,TS val 1182950575 ecr 612707486], length 224
20:45:34.734304 IP 178.128.234.189.22 > 162.243.188.66.27289: Flags [P.], seq 22560:22624, ack 1, win 501, options [nop,nop,TS val 1182950575 ecr 612707486], length 64
20:45:34.734345 IP 178.128.234.189.22 > 162.243.188.66.27289: Flags [P.], seq 22624:22848, ack 1, win 501, options [nop,nop,TS val 1182950575 ecr 612707486], length 224
20:45:34.734386 IP 178.128.234.189.22 > 162.243.188.66.27289: Flags [P.], seq 22848:22912, ack 1, win 501, options [nop,nop,TS val 1182950575 ecr 612707486], length 64
20:45:34.734443 IP 178.128.234.189.22 > 162.243.188.66.27289: Flags [P.], seq 22912:23136, ack 1, win 501, options [nop,nop,TS val 1182950575 ecr 612707486], length 224
20:45:34.734554 IP 178.128.234.189.22 > 162.243.188.66.27289: Flags [P.], seq 23136:23488, ack 1, win 501, options [nop,nop,TS val 1182950575 ecr 612707486], length 352
20:45:34.734599 IP 178.128.234.189.22 > 162.243.188.66.27289: Flags [P.], seq 23488:23712, ack 1, win 501, options [nop,nop,TS val 1182950575 ecr 612707486], length 224
20:45:34.734628 IP 178.128.234.189.22 > 162.243.188.66.27289: Flags [P.], seq 23712:23776, ack 1, win 501, options [nop,nop,TS val 1182950575 ecr 612707486], length 64
20:45:34.734668 IP 178.128.234.189.22 > 162.243.188.66.27289: Flags [P.], seq 23776:24000, ack 1, win 501, options [nop,nop,TS val 1182950575 ecr 612707486], length 224
20:45:34.734696 IP 178.128.234.189.22 > 162.243.188.66.27289: Flags [P.], seq 24000:24064, ack 1, win 501, options [nop,nop,TS val 1182950575 ecr 612707486], length 64
20:45:34.734749 IP 178.128.234.189.22 > 162.243.188.66.27289: Flags [P.], seq 24064:24288, ack 1, win 501, options [nop,nop,TS val 1182950576 ecr 612707486], length 224
20:45:34.734789 IP 178.128.234.189.22 > 162.243.188.66.27289: Flags [P.], seq 24288:24352, ack 1, win 501, options [nop,nop,TS val 1182950576 ecr 612707486], length 64
20:45:34.734840 IP 178.128.234.189.22 > 162.243.188.66.27289: Flags [P.], seq 24352:24576, ack 1, win 501, options [nop,nop,TS val 1182950576 ecr 612707486], length 224
20:45:34.734870 IP 178.128.234.189.22 > 162.243.188.66.27289: Flags [P.], seq 24576:24640, ack 1, win 501, options [nop,nop,TS val 1182950576 ecr 612707486], length 64
20:45:34.734908 IP 178.128.234.189.22 > 162.243.188.66.27289: Flags [P.], seq 24640:24864, ack 1, win 501, options [nop,nop,TS val 1182950576 ecr 612707486], length 224
20:45:34.734945 IP 178.128.234.189.22 > 162.243.188.66.27289: Flags [P.], seq 24864:24928, ack 1, win 501, options [nop,nop,TS val 1182950576 ecr 612707486], length 64
20:45:34.734995 IP 178.128.234.189.22 > 162.243.188.66.27289: Flags [P.], seq 24928:25152, ack 1, win 501, options [nop,nop,TS val 1182950576 ecr 612707486], length 224
20:45:34.735024 IP 178.128.234.189.22 > 162.243.188.66.27289: Flags [P.], seq 25152:25216, ack 1, win 501, options [nop,nop,TS val 1182950576 ecr 612707486], length 64
20:45:34.735066 IP 178.128.234.189.22 > 162.243.188.66.27289: Flags [P.], seq 25216:25440, ack 1, win 501, options [nop,nop,TS val 1182950576 ecr 612707486], length 224
20:45:34.735094 IP 178.128.234.189.22 > 162.243.188.66.27289: Flags [P.], seq 25440:25504, ack 1, win 501, options [nop,nop,TS val 1182950576 ecr 612707486], length 64
20:45:34.735142 IP 178.128.234.189.22 > 162.243.188.66.27289: Flags [P.], seq 25504:25728, ack 1, win 501, options [nop,nop,TS val 1182950576 ecr 612707486], length 224
20:45:34.735231 IP 178.128.234.189.22 > 162.243.188.66.27289: Flags [P.], seq 25728:26016, ack 1, win 501, options [nop,nop,TS val 1182950576 ecr 612707486], length 288
20:45:34.735251 IP 178.128.234.189.22 > 162.243.188.66.27289: Flags [P.], seq 26016:26080, ack 1, win 501, options [nop,nop,TS val 1182950576 ecr 612707486], length 64
20:45:34.735300 IP 178.128.234.189.22 > 162.243.188.66.27289: Flags [P.], seq 26080:26304, ack 1, win 501, options [nop,nop,TS val 1182950576 ecr 612707486], length 224
20:45:34.735334 IP 178.128.234.189.22 > 162.243.188.66.27289: Flags [P.], seq 26304:26368, ack 1, win 501, options [nop,nop,TS val 1182950576 ecr 612707486], length 64
20:45:34.735389 IP 178.128.234.189.22 > 162.243.188.66.27289: Flags [P.], seq 26368:26592, ack 1, win 501, options [nop,nop,TS val 1182950576 ecr 612707486], length 224
20:45:34.735461 IP 178.128.234.189.22 > 162.243.188.66.27289: Flags [P.], seq 26592:26880, ack 1, win 501, options [nop,nop,TS val 1182950576 ecr 612707486], length 288
20:45:34.735522 IP 178.128.234.189.22 > 162.243.188.66.27289: Flags [P.], seq 26880:26944, ack 1, win 501, options [nop,nop,TS val 1182950576 ecr 612707486], length 64
20:45:34.735574 IP 178.128.234.189.22 > 162.243.188.66.27289: Flags [P.], seq 26944:27168, ack 1, win 501, options [nop,nop,TS val 1182950576 ecr 612707486], length 224
20:45:34.735614 IP 178.128.234.189.22 > 162.243.188.66.27289: Flags [P.], seq 27168:27232, ack 1, win 501, options [nop,nop,TS val 1182950576 ecr 612707486], length 64
20:45:34.735673 IP 178.128.234.189.22 > 162.243.188.66.27289: Flags [P.], seq 27232:27456, ack 1, win 501, options [nop,nop,TS val 1182950576 ecr 612707486], length 224
20:45:34.735719 IP 178.128.234.189.22 > 162.243.188.66.27289: Flags [P.], seq 27456:27520, ack 1, win 501, options [nop,nop,TS val 1182950577 ecr 612707486], length 64
20:45:34.735777 IP 178.128.234.189.22 > 162.243.188.66.27289: Flags [P.], seq 27520:27744, ack 1, win 501, options [nop,nop,TS val 1182950577 ecr 612707486], length 224
20:45:34.735852 IP 178.128.234.189.22 > 162.243.188.66.27289: Flags [P.], seq 27744:28032, ack 1, win 501, options [nop,nop,TS val 1182950577 ecr 612707486], length 288
20:45:34.735930 IP 178.128.234.189.22 > 162.243.188.66.27289: Flags [P.], seq 28032:28320, ack 1, win 501, options [nop,nop,TS val 1182950577 ecr 612707486], length 288
20:45:34.735966 IP 178.128.234.189.22 > 162.243.188.66.27289: Flags [P.], seq 28320:28384, ack 1, win 501, options [nop,nop,TS val 1182950577 ecr 612707486], length 64
20:45:34.736043 IP 178.128.234.189.22 > 162.243.188.66.27289: Flags [P.], seq 28384:28608, ack 1, win 501, options [nop,nop,TS val 1182950577 ecr 612707486], length 224
20:45:34.736115 IP 178.128.234.189.22 > 162.243.188.66.27289: Flags [P.], seq 28608:28896, ack 1, win 501, options [nop,nop,TS val 1182950577 ecr 612707486], length 288
20:45:34.736153 IP 178.128.234.189.22 > 162.243.188.66.27289: Flags [P.], seq 28896:28960, ack 1, win 501, options [nop,nop,TS val 1182950577 ecr 612707486], length 64
20:45:34.736430 IP 178.128.234.189.22 > 162.243.188.66.27289: Flags [P.], seq 28960:29184, ack 1, win 501, options [nop,nop,TS val 1182950577 ecr 612707486], length 224
20:45:34.736474 IP 178.128.234.189.22 > 162.243.188.66.27289: Flags [P.], seq 29184:29248, ack 1, win 501, options [nop,nop,TS val 1182950577 ecr 612707486], length 64
20:45:34.736528 IP 178.128.234.189.22 > 162.243.188.66.27289: Flags [P.], seq 29248:29472, ack 1, win 501, options [nop,nop,TS val 1182950577 ecr 612707486], length 224
20:45:34.736566 IP 178.128.234.189.22 > 162.243.188.66.27289: Flags [P.], seq 29472:29536, ack 1, win 501, options [nop,nop,TS val 1182950577 ecr 612707486], length 64
20:45:34.736622 IP 178.128.234.189.22 > 162.243.188.66.27289: Flags [P.], seq 29536:29760, ack 1, win 501, options [nop,nop,TS val 1182950577 ecr 612707486], length 224
20:45:34.736665 IP 178.128.234.189.22 > 162.243.188.66.27289: Flags [P.], seq 29760:29824, ack 1, win 501, options [nop,nop,TS val 1182950577 ecr 612707486], length 64
20:45:34.736720 IP 178.128.234.189.22 > 162.243.188.66.27289: Flags [P.], seq 29824:30048, ack 1, win 501, options [nop,nop,TS val 1182950578 ecr 612707486], length 224
20:45:34.736889 IP 178.128.234.189.22 > 162.243.188.66.27289: Flags [P.], seq 30048:30496, ack 1, win 501, options [nop,nop,TS val 1182950578 ecr 612707486], length 448
20:45:34.736946 IP 178.128.234.189.22 > 162.243.188.66.27289: Flags [P.], seq 30496:30560, ack 1, win 501, options [nop,nop,TS val 1182950578 ecr 612707486], length 64
20:45:34.737066 IP 178.128.234.189.22 > 162.243.188.66.27289: Flags [P.], seq 30560:30960, ack 1, win 501, options [nop,nop,TS val 1182950578 ecr 612707486], length 400
20:45:34.737217 IP 178.128.234.189.22 > 162.243.188.66.27289: Flags [P.], seq 30960:31872, ack 1, win 501, options [nop,nop,TS val 1182950578 ecr 612707486], length 912
20:45:34.737310 IP 178.128.234.189.22 > 162.243.188.66.27289: Flags [P.], seq 31872:32432, ack 1, win 501, options [nop,nop,TS val 1182950578 ecr 612707486], length 560
20:45:34.737410 IP 178.128.234.189.22 > 162.243.188.66.27289: Flags [P.], seq 32432:32992, ack 1, win 501, options [nop,nop,TS val 1182950578 ecr 612707486], length 560
20:45:34.737508 IP 178.128.234.189.22 > 162.243.188.66.27289: Flags [P.], seq 32992:33552, ack 1, win 501, options [nop,nop,TS val 1182950578 ecr 612707486], length 560
20:45:34.737616 IP 178.128.234.189.22 > 162.243.188.66.27289: Flags [P.], seq 33552:33920, ack 1, win 501, options [nop,nop,TS val 1182950578 ecr 612707486], length 368
20:45:34.737722 IP 178.128.234.189.22 > 162.243.188.66.27289: Flags [P.], seq 33920:34288, ack 1, win 501, options [nop,nop,TS val 1182950579 ecr 612707486], length 368
20:45:34.737814 IP 178.128.234.189.22 > 162.243.188.66.27289: Flags [P.], seq 34288:34656, ack 1, win 501, options [nop,nop,TS val 1182950579 ecr 612707486], length 368
20:45:34.747349 IP 162.243.188.66.27289 > 178.128.234.189.22: Flags [.], ack 22848, win 4768, options [nop,nop,TS val 612707556 ecr 1182950575], length 0
20:45:34.747755 IP 162.243.188.66.27289 > 178.128.234.189.22: Flags [.], ack 24352, win 4768, options [nop,nop,TS val 612707557 ecr 1182950575], length 0
20:45:34.748316 IP 162.243.188.66.27289 > 178.128.234.189.22: Flags [.], ack 26016, win 4768, options [nop,nop,TS val 612707557 ecr 1182950576], length 0
20:45:34.748720 IP 162.243.188.66.27289 > 178.128.234.189.22: Flags [.], ack 27520, win 4768, options [nop,nop,TS val 612707557 ecr 1182950576], length 0
20:45:34.749389 IP 162.243.188.66.27289 > 178.128.234.189.22: Flags [.], ack 29184, win 4768, options [nop,nop,TS val 612707558 ecr 1182950577], length 0
20:45:34.750196 IP 162.243.188.66.27289 > 178.128.234.189.22: Flags [.], ack 30960, win 4768, options [nop,nop,TS val 612707559 ecr 1182950577], length 0
20:45:34.750275 IP 162.243.188.66.27289 > 178.128.234.189.22: Flags [.], ack 32432, win 4768, options [nop,nop,TS val 612707559 ecr 1182950578], length 0
20:45:34.750454 IP 162.243.188.66.27289 > 178.128.234.189.22: Flags [.], ack 33552, win 4768, options [nop,nop,TS val 612707559 ecr 1182950578], length 0
20:45:34.750711 IP 162.243.188.66.27289 > 178.128.234.189.22: Flags [.], ack 34288, win 4768, options [nop,nop,TS val 612707560 ecr 1182950578], length 0
20:45:34.794228 IP 162.243.188.66.27289 > 178.128.234.189.22: Flags [.], ack 34656, win 4768, options [nop,nop,TS val 612707603 ecr 1182950579], length 0
20:45:34.838008 IP 178.128.234.189.22 > 162.243.188.66.27289: Flags [P.], seq 34656:34880, ack 1, win 501, options [nop,nop,TS val 1182950679 ecr 612707603], length 224
20:45:34.838155 IP 178.128.234.189.22 > 162.243.188.66.27289: Flags [P.], seq 34880:36128, ack 1, win 501, options [nop,nop,TS val 1182950679 ecr 612707603], length 1248
20:45:34.838282 IP 178.128.234.189.22 > 162.243.188.66.27289: Flags [P.], seq 36128:37264, ack 1, win 501, options [nop,nop,TS val 1182950679 ecr 612707603], length 1136
20:45:34.838314 IP 178.128.234.189.22 > 162.243.188.66.27289: Flags [P.], seq 37264:37328, ack 1, win 501, options [nop,nop,TS val 1182950679 ecr 612707603], length 64
20:45:34.838358 IP 178.128.234.189.22 > 162.243.188.66.27289: Flags [P.], seq 37328:37552, ack 1, win 501, options [nop,nop,TS val 1182950679 ecr 612707603], length 224
20:45:34.838414 IP 178.128.234.189.22 > 162.243.188.66.27289: Flags [P.], seq 37552:37952, ack 1, win 501, options [nop,nop,TS val 1182950679 ecr 612707603], length 400
20:45:34.838526 IP 178.128.234.189.22 > 162.243.188.66.27289: Flags [P.], seq 37952:38352, ack 1, win 501, options [nop,nop,TS val 1182950679 ecr 612707603], length 400
20:45:34.838599 IP 178.128.234.189.22 > 162.243.188.66.27289: Flags [P.], seq 38352:38912, ack 1, win 501, options [nop,nop,TS val 1182950679 ecr 612707603], length 560
20:45:34.838669 IP 178.128.234.189.22 > 162.243.188.66.27289: Flags [P.], seq 38912:39472, ack 1, win 501, options [nop,nop,TS val 1182950679 ecr 612707603], length 560
20:45:34.838724 IP 178.128.234.189.22 > 162.243.188.66.27289: Flags [P.], seq 39472:39872, ack 1, win 501, options [nop,nop,TS val 1182950680 ecr 612707603], length 400
20:45:34.838792 IP 178.128.234.189.22 > 162.243.188.66.27289: Flags [P.], seq 39872:40432, ack 1, win 501, options [nop,nop,TS val 1182950680 ecr 612707603], length 560
20:45:34.838847 IP 178.128.234.189.22 > 162.243.188.66.27289: Flags [P.], seq 40432:40832, ack 1, win 501, options [nop,nop,TS val 1182950680 ecr 612707603], length 400
20:45:34.838918 IP 178.128.234.189.22 > 162.243.188.66.27289: Flags [P.], seq 40832:41392, ack 1, win 501, options [nop,nop,TS val 1182950680 ecr 612707603], length 560
20:45:34.838977 IP 178.128.234.189.22 > 162.243.188.66.27289: Flags [P.], seq 41392:41792, ack 1, win 501, options [nop,nop,TS val 1182950680 ecr 612707603], length 400
20:45:34.839045 IP 178.128.234.189.22 > 162.243.188.66.27289: Flags [P.], seq 41792:42352, ack 1, win 501, options [nop,nop,TS val 1182950680 ecr 612707603], length 560
20:45:34.839101 IP 178.128.234.189.22 > 162.243.188.66.27289: Flags [P.], seq 42352:42752, ack 1, win 501, options [nop,nop,TS val 1182950680 ecr 612707603], length 400
20:45:34.839173 IP 178.128.234.189.22 > 162.243.188.66.27289: Flags [P.], seq 42752:43152, ack 1, win 501, options [nop,nop,TS val 1182950680 ecr 612707603], length 400
20:45:34.839244 IP 178.128.234.189.22 > 162.243.188.66.27289: Flags [P.], seq 43152:43552, ack 1, win 501, options [nop,nop,TS val 1182950680 ecr 612707603], length 400
20:45:34.839308 IP 178.128.234.189.22 > 162.243.188.66.27289: Flags [P.], seq 43552:43776, ack 1, win 501, options [nop,nop,TS val 1182950680 ecr 612707603], length 224
20:45:34.839409 IP 178.128.234.189.22 > 162.243.188.66.27289: Flags [P.], seq 43776:44336, ack 1, win 501, options [nop,nop,TS val 1182950680 ecr 612707603], length 560
20:45:34.839499 IP 178.128.234.189.22 > 162.243.188.66.27289: Flags [P.], seq 44336:44896, ack 1, win 501, options [nop,nop,TS val 1182950680 ecr 612707603], length 560
20:45:34.839568 IP 178.128.234.189.22 > 162.243.188.66.27289: Flags [P.], seq 44896:45456, ack 1, win 501, options [nop,nop,TS val 1182950680 ecr 612707603], length 560
20:45:34.839635 IP 178.128.234.189.22 > 162.243.188.66.27289: Flags [P.], seq 45456:46016, ack 1, win 501, options [nop,nop,TS val 1182950680 ecr 612707603], length 560
20:45:34.839691 IP 178.128.234.189.22 > 162.243.188.66.27289: Flags [P.], seq 46016:46384, ack 1, win 501, options [nop,nop,TS val 1182950680 ecr 612707603], length 368
20:45:34.839757 IP 178.128.234.189.22 > 162.243.188.66.27289: Flags [P.], seq 46384:46912, ack 1, win 501, options [nop,nop,TS val 1182950681 ecr 612707603], length 528
20:45:34.839889 IP 178.128.234.189.22 > 162.243.188.66.27289: Flags [P.], seq 46912:47280, ack 1, win 501, options [nop,nop,TS val 1182950681 ecr 612707603], length 368
20:45:34.839985 IP 178.128.234.189.22 > 162.243.188.66.27289: Flags [P.], seq 47280:47808, ack 1, win 501, options [nop,nop,TS val 1182950681 ecr 612707603], length 528
20:45:34.851333 IP 162.243.188.66.27289 > 178.128.234.189.22: Flags [.], ack 36128, win 4768, options [nop,nop,TS val 612707660 ecr 1182950679], length 0
20:45:34.851393 IP 162.243.188.66.27289 > 178.128.234.189.22: Flags [.], ack 37552, win 4768, options [nop,nop,TS val 612707660 ecr 1182950679], length 0
20:45:34.851692 IP 162.243.188.66.27289 > 178.128.234.189.22: Flags [.], ack 38912, win 4768, options [nop,nop,TS val 612707660 ecr 1182950679], length 0
20:45:34.851786 IP 162.243.188.66.27289 > 178.128.234.189.22: Flags [.], ack 39872, win 4768, options [nop,nop,TS val 612707661 ecr 1182950679], length 0
20:45:34.851965 IP 162.243.188.66.27289 > 178.128.234.189.22: Flags [.], ack 40832, win 4768, options [nop,nop,TS val 612707661 ecr 1182950680], length 0
20:45:34.852186 IP 162.243.188.66.27289 > 178.128.234.189.22: Flags [.], ack 41792, win 4768, options [nop,nop,TS val 612707661 ecr 1182950680], length 0
20:45:34.852269 IP 162.243.188.66.27289 > 178.128.234.189.22: Flags [.], ack 42752, win 4768, options [nop,nop,TS val 612707661 ecr 1182950680], length 0
20:45:34.852269 IP 162.243.188.66.27289 > 178.128.234.189.22: Flags [.], ack 43552, win 4768, options [nop,nop,TS val 612707661 ecr 1182950680], length 0
20:45:34.852390 IP 162.243.188.66.27289 > 178.128.234.189.22: Flags [.], ack 44336, win 4768, options [nop,nop,TS val 612707661 ecr 1182950680], length 0
20:45:34.852539 IP 162.243.188.66.27289 > 178.128.234.189.22: Flags [.], ack 45456, win 4768, options [nop,nop,TS val 612707661 ecr 1182950680], length 0
20:45:34.852663 IP 162.243.188.66.27289 > 178.128.234.189.22: Flags [.], ack 46384, win 4768, options [nop,nop,TS val 612707661 ecr 1182950680], length 0
20:45:34.852905 IP 162.243.188.66.27289 > 178.128.234.189.22: Flags [.], ack 47280, win 4768, options [nop,nop,TS val 612707662 ecr 1182950681], length 0
20:45:34.888861 IP 162.243.188.66.27289 > 178.128.234.189.22: Flags [.], ack 47808, win 4768, options [nop,nop,TS val 612707698 ecr 1182950681], length 0
20:45:34.941978 IP 178.128.234.189.22 > 162.243.188.66.27289: Flags [P.], seq 47808:48032, ack 1, win 501, options [nop,nop,TS val 1182950783 ecr 612707698], length 224
20:45:34.942139 IP 178.128.234.189.22 > 162.243.188.66.27289: Flags [P.], seq 48032:48432, ack 1, win 501, options [nop,nop,TS val 1182950783 ecr 612707698], length 400
20:45:34.942228 IP 178.128.234.189.22 > 162.243.188.66.27289: Flags [P.], seq 48432:48832, ack 1, win 501, options [nop,nop,TS val 1182950783 ecr 612707698], length 400
20:45:34.942312 IP 178.128.234.189.22 > 162.243.188.66.27289: Flags [P.], seq 48832:49232, ack 1, win 501, options [nop,nop,TS val 1182950783 ecr 612707698], length 400
20:45:34.942408 IP 178.128.234.189.22 > 162.243.188.66.27289: Flags [P.], seq 49232:49792, ack 1, win 501, options [nop,nop,TS val 1182950783 ecr 612707698], length 560
20:45:34.942511 IP 178.128.234.189.22 > 162.243.188.66.27289: Flags [P.], seq 49792:50192, ack 1, win 501, options [nop,nop,TS val 1182950783 ecr 612707698], length 400
20:45:34.942611 IP 178.128.234.189.22 > 162.243.188.66.27289: Flags [P.], seq 50192:50752, ack 1, win 501, options [nop,nop,TS val 1182950783 ecr 612707698], length 560
20:45:34.942694 IP 178.128.234.189.22 > 162.243.188.66.27289: Flags [P.], seq 50752:51152, ack 1, win 501, options [nop,nop,TS val 1182950783 ecr 612707698], length 400
20:45:34.942793 IP 178.128.234.189.22 > 162.243.188.66.27289: Flags [P.], seq 51152:51712, ack 1, win 501, options [nop,nop,TS val 1182950784 ecr 612707698], length 560
20:45:34.942892 IP 178.128.234.189.22 > 162.243.188.66.27289: Flags [P.], seq 51712:52272, ack 1, win 501, options [nop,nop,TS val 1182950784 ecr 612707698], length 560
20:45:34.942973 IP 178.128.234.189.22 > 162.243.188.66.27289: Flags [P.], seq 52272:52672, ack 1, win 501, options [nop,nop,TS val 1182950784 ecr 612707698], length 400
20:45:34.943108 IP 178.128.234.189.22 > 162.243.188.66.27289: Flags [P.], seq 52672:53440, ack 1, win 501, options [nop,nop,TS val 1182950784 ecr 612707698], length 768
20:45:34.943191 IP 178.128.234.189.22 > 162.243.188.66.27289: Flags [P.], seq 53440:53808, ack 1, win 501, options [nop,nop,TS val 1182950784 ecr 612707698], length 368
20:45:34.943271 IP 178.128.234.189.22 > 162.243.188.66.27289: Flags [P.], seq 53808:54176, ack 1, win 501, options [nop,nop,TS val 1182950784 ecr 612707698], length 368
20:45:34.943342 IP 178.128.234.189.22 > 162.243.188.66.27289: Flags [P.], seq 54176:54704, ack 1, win 501, options [nop,nop,TS val 1182950784 ecr 612707698], length 528
20:45:34.943439 IP 178.128.234.189.22 > 162.243.188.66.27289: Flags [P.], seq 54704:55440, ack 1, win 501, options [nop,nop,TS val 1182950784 ecr 612707698], length 736
20:45:34.955494 IP 162.243.188.66.27289 > 178.128.234.189.22: Flags [.], ack 48432, win 4768, options [nop,nop,TS val 612707764 ecr 1182950783], length 0
20:45:34.955540 IP 162.243.188.66.27289 > 178.128.234.189.22: Flags [.], ack 49232, win 4768, options [nop,nop,TS val 612707764 ecr 1182950783], length 0
20:45:34.955650 IP 162.243.188.66.27289 > 178.128.234.189.22: Flags [.], ack 50192, win 4768, options [nop,nop,TS val 612707764 ecr 1182950783], length 0
20:45:34.955910 IP 162.243.188.66.27289 > 178.128.234.189.22: Flags [.], ack 51152, win 4768, options [nop,nop,TS val 612707764 ecr 1182950783], length 0
20:45:34.956354 IP 162.243.188.66.27289 > 178.128.234.189.22: Flags [.], ack 52272, win 4768, options [nop,nop,TS val 612707765 ecr 1182950784], length 0
20:45:34.956414 IP 162.243.188.66.27289 > 178.128.234.189.22: Flags [.], ack 53440, win 4768, options [nop,nop,TS val 612707765 ecr 1182950784], length 0
20:45:34.956674 IP 162.243.188.66.27289 > 178.128.234.189.22: Flags [.], ack 54704, win 4768, options [nop,nop,TS val 612707765 ecr 1182950784], length 0
20:45:35.001204 IP 162.243.188.66.27289 > 178.128.234.189.22: Flags [.], ack 55440, win 4768, options [nop,nop,TS val 612707810 ecr 1182950784], length 0
20:45:35.046058 IP 178.128.234.189.22 > 162.243.188.66.27289: Flags [P.], seq 55440:55664, ack 1, win 501, options [nop,nop,TS val 1182950887 ecr 612707810], length 224
20:45:35.046186 IP 178.128.234.189.22 > 162.243.188.66.27289: Flags [P.], seq 55664:55888, ack 1, win 501, options [nop,nop,TS val 1182950887 ecr 612707810], length 224
20:45:35.046252 IP 178.128.234.189.22 > 162.243.188.66.27289: Flags [P.], seq 55888:56112, ack 1, win 501, options [nop,nop,TS val 1182950887 ecr 612707810], length 224
20:45:35.046296 IP 178.128.234.189.22 > 162.243.188.66.27289: Flags [P.], seq 56112:56336, ack 1, win 501, options [nop,nop,TS val 1182950887 ecr 612707810], length 224
20:45:35.046364 IP 178.128.234.189.22 > 162.243.188.66.27289: Flags [P.], seq 56336:56896, ack 1, win 501, options [nop,nop,TS val 1182950887 ecr 612707810], length 560
20:45:35.046431 IP 178.128.234.189.22 > 162.243.188.66.27289: Flags [P.], seq 56896:57456, ack 1, win 501, options [nop,nop,TS val 1182950887 ecr 612707810], length 560
20:45:35.046489 IP 178.128.234.189.22 > 162.243.188.66.27289: Flags [P.], seq 57456:57856, ack 1, win 501, options [nop,nop,TS val 1182950887 ecr 612707810], length 400
20:45:35.046569 IP 178.128.234.189.22 > 162.243.188.66.27289: Flags [P.], seq 57856:58256, ack 1, win 501, options [nop,nop,TS val 1182950887 ecr 612707810], length 400
20:45:35.046679 IP 178.128.234.189.22 > 162.243.188.66.27289: Flags [P.], seq 58256:58816, ack 1, win 501, options [nop,nop,TS val 1182950887 ecr 612707810], length 560
20:45:35.046779 IP 178.128.234.189.22 > 162.243.188.66.27289: Flags [P.], seq 58816:59648, ack 1, win 501, options [nop,nop,TS val 1182950888 ecr 612707810], length 832
20:45:35.046849 IP 178.128.234.189.22 > 162.243.188.66.27289: Flags [P.], seq 59648:60016, ack 1, win 501, options [nop,nop,TS val 1182950888 ecr 612707810], length 368
20:45:35.059314 IP 162.243.188.66.27289 > 178.128.234.189.22: Flags [.], ack 56336, win 4768, options [nop,nop,TS val 612707868 ecr 1182950887], length 0
20:45:35.059364 IP 162.243.188.66.27289 > 178.128.234.189.22: Flags [.], ack 57456, win 4768, options [nop,nop,TS val 612707868 ecr 1182950887], length 0
20:45:35.059556 IP 162.243.188.66.27289 > 178.128.234.189.22: Flags [.], ack 58256, win 4768, options [nop,nop,TS val 612707868 ecr 1182950887], length 0
20:45:35.059749 IP 162.243.188.66.27289 > 178.128.234.189.22: Flags [.], ack 59648, win 4768, options [nop,nop,TS val 612707869 ecr 1182950887], length 0
20:45:35.077478 IP 162.243.188.66.27289 > 178.128.234.189.22: Flags [.], ack 60016, win 4768, options [nop,nop,TS val 612707886 ecr 1182950888], length 0
20:45:35.149984 IP 178.128.234.189.22 > 162.243.188.66.27289: Flags [P.], seq 60016:60240, ack 1, win 501, options [nop,nop,TS val 1182950991 ecr 612707886], length 224
20:45:35.150102 IP 178.128.234.189.22 > 162.243.188.66.27289: Flags [P.], seq 60240:60464, ack 1, win 501, options [nop,nop,TS val 1182950991 ecr 612707886], length 224
20:45:35.150194 IP 178.128.234.189.22 > 162.243.188.66.27289: Flags [P.], seq 60464:61200, ack 1, win 501, options [nop,nop,TS val 1182950991 ecr 612707886], length 736
20:45:35.150280 IP 178.128.234.189.22 > 162.243.188.66.27289: Flags [P.], seq 61200:61600, ack 1, win 501, options [nop,nop,TS val 1182950991 ecr 612707886], length 400
20:45:35.150356 IP 178.128.234.189.22 > 162.243.188.66.27289: Flags [P.], seq 61600:62160, ack 1, win 501, options [nop,nop,TS val 1182950991 ecr 612707886], length 560
20:45:35.150412 IP 178.128.234.189.22 > 162.243.188.66.27289: Flags [P.], seq 62160:62528, ack 1, win 501, options [nop,nop,TS val 1182950991 ecr 612707886], length 368
20:45:35.150467 IP 178.128.234.189.22 > 162.243.188.66.27289: Flags [P.], seq 62528:62896, ack 1, win 501, options [nop,nop,TS val 1182950991 ecr 612707886], length 368
20:45:35.150524 IP 178.128.234.189.22 > 162.243.188.66.27289: Flags [P.], seq 62896:63104, ack 1, win 501, options [nop,nop,TS val 1182950991 ecr 612707886], length 208
20:45:35.163241 IP 162.243.188.66.27289 > 178.128.234.189.22: Flags [.], ack 61200, win 4768, options [nop,nop,TS val 612707972 ecr 1182950991], length 0
20:45:35.163354 IP 162.243.188.66.27289 > 178.128.234.189.22: Flags [.], ack 62160, win 4768, options [nop,nop,TS val 612707972 ecr 1182950991], length 0
20:45:35.163614 IP 162.243.188.66.27289 > 178.128.234.189.22: Flags [.], ack 63104, win 4768, options [nop,nop,TS val 612707972 ecr 1182950991], length 0
20:45:35.253973 IP 178.128.234.189.22 > 162.243.188.66.27289: Flags [P.], seq 63104:63328, ack 1, win 501, options [nop,nop,TS val 1182951095 ecr 612707972], length 224
20:45:35.254116 IP 178.128.234.189.22 > 162.243.188.66.27289: Flags [P.], seq 63328:64400, ack 1, win 501, options [nop,nop,TS val 1182951095 ecr 612707972], length 1072
20:45:35.254217 IP 178.128.234.189.22 > 162.243.188.66.27289: Flags [P.], seq 64400:64944, ack 1, win 501, options [nop,nop,TS val 1182951095 ecr 612707972], length 544
20:45:35.254274 IP 178.128.234.189.22 > 162.243.188.66.27289: Flags [P.], seq 64944:65152, ack 1, win 501, options [nop,nop,TS val 1182951095 ecr 612707972], length 208
20:45:35.267268 IP 162.243.188.66.27289 > 178.128.234.189.22: Flags [.], ack 64400, win 4768, options [nop,nop,TS val 612708076 ecr 1182951095], length 0
20:45:35.282883 IP 162.243.188.66.27289 > 178.128.234.189.22: Flags [.], ack 65152, win 4768, options [nop,nop,TS val 612708091 ecr 1182951095], length 0
20:45:35.357924 IP 178.128.234.189.22 > 162.243.188.66.27289: Flags [P.], seq 65152:65376, ack 1, win 501, options [nop,nop,TS val 1182951199 ecr 612708091], length 224
20:45:35.358051 IP 178.128.234.189.22 > 162.243.188.66.27289: Flags [P.], seq 65376:66256, ack 1, win 501, options [nop,nop,TS val 1182951199 ecr 612708091], length 880
20:45:35.358087 IP 178.128.234.189.22 > 162.243.188.66.27289: Flags [P.], seq 66256:66320, ack 1, win 501, options [nop,nop,TS val 1182951199 ecr 612708091], length 64
20:45:35.371059 IP 162.243.188.66.27289 > 178.128.234.189.22: Flags [.], ack 66256, win 4768, options [nop,nop,TS val 612708180 ecr 1182951199], length 0
20:45:35.399142 IP 162.243.188.66.27289 > 178.128.234.189.22: Flags [.], ack 66320, win 4768, options [nop,nop,TS val 612708208 ecr 1182951199], length 0
20:45:35.461963 IP 178.128.234.189.22 > 162.243.188.66.27289: Flags [P.], seq 66320:66544, ack 1, win 501, options [nop,nop,TS val 1182951303 ecr 612708208], length 224
20:45:35.462083 IP 178.128.234.189.22 > 162.243.188.66.27289: Flags [P.], seq 66544:67248, ack 1, win 501, options [nop,nop,TS val 1182951303 ecr 612708208], length 704
20:45:35.462125 IP 178.128.234.189.22 > 162.243.188.66.27289: Flags [P.], seq 67248:67312, ack 1, win 501, options [nop,nop,TS val 1182951303 ecr 612708208], length 64
20:45:35.479210 IP 162.243.188.66.27289 > 178.128.234.189.22: Flags [.], ack 67312, win 4768, options [nop,nop,TS val 612708288 ecr 1182951303], length 0
20:45:35.565947 IP 178.128.234.189.22 > 162.243.188.66.27289: Flags [P.], seq 67312:67536, ack 1, win 501, options [nop,nop,TS val 1182951407 ecr 612708288], length 224
20:45:35.566081 IP 178.128.234.189.22 > 162.243.188.66.27289: Flags [P.], seq 67536:68096, ack 1, win 501, options [nop,nop,TS val 1182951407 ecr 612708288], length 560
20:45:35.586605 IP 162.243.188.66.27289 > 178.128.234.189.22: Flags [.], ack 68096, win 4768, options [nop,nop,TS val 612708395 ecr 1182951407], length 0
20:45:35.669958 IP 178.128.234.189.22 > 162.243.188.66.27289: Flags [P.], seq 68096:68320, ack 1, win 501, options [nop,nop,TS val 1182951511 ecr 612708395], length 224
20:45:35.670058 IP 178.128.234.189.22 > 162.243.188.66.27289: Flags [P.], seq 68320:68704, ack 1, win 501, options [nop,nop,TS val 1182951511 ecr 612708395], length 384
20:45:35.686459 IP 162.243.188.66.27289 > 178.128.234.189.22: Flags [.], ack 68704, win 4768, options [nop,nop,TS val 612708495 ecr 1182951511], length 0
20:45:35.773965 IP 178.128.234.189.22 > 162.243.188.66.27289: Flags [P.], seq 68704:68928, ack 1, win 501, options [nop,nop,TS val 1182951615 ecr 612708495], length 224
20:45:35.774129 IP 178.128.234.189.22 > 162.243.188.66.27289: Flags [P.], seq 68928:69312, ack 1, win 501, options [nop,nop,TS val 1182951615 ecr 612708495], length 384
20:45:35.793682 IP 162.243.188.66.27289 > 178.128.234.189.22: Flags [.], ack 69312, win 4768, options [nop,nop,TS val 612708602 ecr 1182951615], length 0
20:45:35.877987 IP 178.128.234.189.22 > 162.243.188.66.27289: Flags [P.], seq 69312:69536, ack 1, win 501, options [nop,nop,TS val 1182951719 ecr 612708602], length 224
20:45:35.878097 IP 178.128.234.189.22 > 162.243.188.66.27289: Flags [P.], seq 69536:69920, ack 1, win 501, options [nop,nop,TS val 1182951719 ecr 612708602], length 384
20:45:35.900282 IP 162.243.188.66.27289 > 178.128.234.189.22: Flags [.], ack 69920, win 4768, options [nop,nop,TS val 612708709 ecr 1182951719], length 0
20:45:35.981961 IP 178.128.234.189.22 > 162.243.188.66.27289: Flags [P.], seq 69920:70144, ack 1, win 501, options [nop,nop,TS val 1182951823 ecr 612708709], length 224
20:45:35.982065 IP 178.128.234.189.22 > 162.243.188.66.27289: Flags [P.], seq 70144:70528, ack 1, win 501, options [nop,nop,TS val 1182951823 ecr 612708709], length 384
20:45:35.997320 IP 162.243.188.66.27289 > 178.128.234.189.22: Flags [.], ack 70528, win 4768, options [nop,nop,TS val 612708806 ecr 1182951823], length 0
20:45:36.085963 IP 178.128.234.189.22 > 162.243.188.66.27289: Flags [P.], seq 70528:70752, ack 1, win 501, options [nop,nop,TS val 1182951927 ecr 612708806], length 224
20:45:36.086100 IP 178.128.234.189.22 > 162.243.188.66.27289: Flags [P.], seq 70752:71136, ack 1, win 501, options [nop,nop,TS val 1182951927 ecr 612708806], length 384
20:45:36.104648 IP 162.243.188.66.27289 > 178.128.234.189.22: Flags [.], ack 71136, win 4768, options [nop,nop,TS val 612708913 ecr 1182951927], length 0
20:45:36.189952 IP 178.128.234.189.22 > 162.243.188.66.27289: Flags [P.], seq 71136:71696, ack 1, win 501, options [nop,nop,TS val 1182952031 ecr 612708913], length 560
20:45:36.207276 IP 162.243.188.66.27289 > 178.128.234.189.22: Flags [.], ack 71696, win 4768, options [nop,nop,TS val 612709016 ecr 1182952031], length 0
20:45:36.294005 IP 178.128.234.189.22 > 162.243.188.66.27289: Flags [P.], seq 71696:72080, ack 1, win 501, options [nop,nop,TS val 1182952135 ecr 612709016], length 384
20:45:36.310318 IP 162.243.188.66.27289 > 178.128.234.189.22: Flags [.], ack 72080, win 4768, options [nop,nop,TS val 612709119 ecr 1182952135], length 0
20:45:36.398050 IP 178.128.234.189.22 > 162.243.188.66.27289: Flags [P.], seq 72080:72464, ack 1, win 501, options [nop,nop,TS val 1182952239 ecr 612709119], length 384
20:45:36.412738 IP 162.243.188.66.27289 > 178.128.234.189.22: Flags [.], ack 72464, win 4768, options [nop,nop,TS val 612709221 ecr 1182952239], length 0
20:45:36.501990 IP 178.128.234.189.22 > 162.243.188.66.27289: Flags [P.], seq 72464:72848, ack 1, win 501, options [nop,nop,TS val 1182952343 ecr 612709221], length 384
20:45:36.521606 IP 162.243.188.66.27289 > 178.128.234.189.22: Flags [.], ack 72848, win 4768, options [nop,nop,TS val 612709330 ecr 1182952343], length 0
20:45:36.605990 IP 178.128.234.189.22 > 162.243.188.66.27289: Flags [P.], seq 72848:73232, ack 1, win 501, options [nop,nop,TS val 1182952447 ecr 612709330], length 384
20:45:36.621608 IP 162.243.188.66.27289 > 178.128.234.189.22: Flags [.], ack 73232, win 4768, options [nop,nop,TS val 612709430 ecr 1182952447], length 0
20:45:36.710023 IP 178.128.234.189.22 > 162.243.188.66.27289: Flags [P.], seq 73232:73616, ack 1, win 501, options [nop,nop,TS val 1182952551 ecr 612709430], length 384
20:45:36.724364 IP 162.243.188.66.27289 > 178.128.234.189.22: Flags [.], ack 73616, win 4768, options [nop,nop,TS val 612709533 ecr 1182952551], length 0
20:45:36.813994 IP 178.128.234.189.22 > 162.243.188.66.27289: Flags [P.], seq 73616:74000, ack 1, win 501, options [nop,nop,TS val 1182952655 ecr 612709533], length 384
20:45:36.828357 IP 162.243.188.66.27289 > 178.128.234.189.22: Flags [.], ack 74000, win 4768, options [nop,nop,TS val 612709637 ecr 1182952655], length 0
20:45:36.917962 IP 178.128.234.189.22 > 162.243.188.66.27289: Flags [P.], seq 74000:74384, ack 1, win 501, options [nop,nop,TS val 1182952759 ecr 612709637], length 384
20:45:36.932044 IP 162.243.188.66.27289 > 178.128.234.189.22: Flags [.], ack 74384, win 4768, options [nop,nop,TS val 612709741 ecr 1182952759], length 0
20:45:37.021967 IP 178.128.234.189.22 > 162.243.188.66.27289: Flags [P.], seq 74384:74768, ack 1, win 501, options [nop,nop,TS val 1182952863 ecr 612709741], length 384
20:45:37.036712 IP 162.243.188.66.27289 > 178.128.234.189.22: Flags [.], ack 74768, win 4768, options [nop,nop,TS val 612709845 ecr 1182952863], length 0
20:45:37.125952 IP 178.128.234.189.22 > 162.243.188.66.27289: Flags [P.], seq 74768:75152, ack 1, win 501, options [nop,nop,TS val 1182952967 ecr 612709845], length 384
20:45:37.142961 IP 162.243.188.66.27289 > 178.128.234.189.22: Flags [.], ack 75152, win 4768, options [nop,nop,TS val 612709952 ecr 1182952967], length 0
20:45:37.229979 IP 178.128.234.189.22 > 162.243.188.66.27289: Flags [P.], seq 75152:75536, ack 1, win 501, options [nop,nop,TS val 1182953071 ecr 612709952], length 384
20:45:37.245799 IP 162.243.188.66.27289 > 178.128.234.189.22: Flags [.], ack 75536, win 4768, options [nop,nop,TS val 612710055 ecr 1182953071], length 0
20:45:37.333939 IP 178.128.234.189.22 > 162.243.188.66.27289: Flags [P.], seq 75536:75920, ack 1, win 501, options [nop,nop,TS val 1182953175 ecr 612710055], length 384
20:45:37.348837 IP 162.243.188.66.27289 > 178.128.234.189.22: Flags [.], ack 75920, win 4768, options [nop,nop,TS val 612710158 ecr 1182953175], length 0
20:45:37.438004 IP 178.128.234.189.22 > 162.243.188.66.27289: Flags [P.], seq 75920:76304, ack 1, win 501, options [nop,nop,TS val 1182953279 ecr 612710158], length 384
20:45:37.452525 IP 162.243.188.66.27289 > 178.128.234.189.22: Flags [.], ack 76304, win 4768, options [nop,nop,TS val 612710261 ecr 1182953279], length 0
20:45:37.541965 IP 178.128.234.189.22 > 162.243.188.66.27289: Flags [P.], seq 76304:76688, ack 1, win 501, options [nop,nop,TS val 1182953383 ecr 612710261], length 384
20:45:37.556651 IP 162.243.188.66.27289 > 178.128.234.189.22: Flags [.], ack 76688, win 4768, options [nop,nop,TS val 612710365 ecr 1182953383], length 0
20:45:37.645993 IP 178.128.234.189.22 > 162.243.188.66.27289: Flags [P.], seq 76688:77072, ack 1, win 501, options [nop,nop,TS val 1182953487 ecr 612710365], length 384
20:45:37.662949 IP 162.243.188.66.27289 > 178.128.234.189.22: Flags [.], ack 77072, win 4768, options [nop,nop,TS val 612710472 ecr 1182953487], length 0
20:45:37.750029 IP 178.128.234.189.22 > 162.243.188.66.27289: Flags [P.], seq 77072:77456, ack 1, win 501, options [nop,nop,TS val 1182953591 ecr 612710472], length 384
20:45:37.766022 IP 162.243.188.66.27289 > 178.128.234.189.22: Flags [.], ack 77456, win 4768, options [nop,nop,TS val 612710575 ecr 1182953591], length 0
20:45:37.853981 IP 178.128.234.189.22 > 162.243.188.66.27289: Flags [P.], seq 77456:77840, ack 1, win 501, options [nop,nop,TS val 1182953695 ecr 612710575], length 384
20:45:37.868491 IP 162.243.188.66.27289 > 178.128.234.189.22: Flags [.], ack 77840, win 4768, options [nop,nop,TS val 612710677 ecr 1182953695], length 0
20:45:37.957965 IP 178.128.234.189.22 > 162.243.188.66.27289: Flags [P.], seq 77840:78224, ack 1, win 501, options [nop,nop,TS val 1182953799 ecr 612710677], length 384
20:45:37.972383 IP 162.243.188.66.27289 > 178.128.234.189.22: Flags [.], ack 78224, win 4768, options [nop,nop,TS val 612710781 ecr 1182953799], length 0
20:45:38.061960 IP 178.128.234.189.22 > 162.243.188.66.27289: Flags [P.], seq 78224:78608, ack 1, win 501, options [nop,nop,TS val 1182953903 ecr 612710781], length 384
20:45:38.076497 IP 162.243.188.66.27289 > 178.128.234.189.22: Flags [.], ack 78608, win 4768, options [nop,nop,TS val 612710885 ecr 1182953903], length 0
20:45:38.165952 IP 178.128.234.189.22 > 162.243.188.66.27289: Flags [P.], seq 78608:78992, ack 1, win 501, options [nop,nop,TS val 1182954007 ecr 612710885], length 384
20:45:38.181259 IP 162.243.188.66.27289 > 178.128.234.189.22: Flags [.], ack 78992, win 4768, options [nop,nop,TS val 612710990 ecr 1182954007], length 0
20:45:38.269956 IP 178.128.234.189.22 > 162.243.188.66.27289: Flags [P.], seq 78992:79376, ack 1, win 501, options [nop,nop,TS val 1182954111 ecr 612710990], length 384
20:45:38.285469 IP 162.243.188.66.27289 > 178.128.234.189.22: Flags [.], ack 79376, win 4768, options [nop,nop,TS val 612711094 ecr 1182954111], length 0
20:45:38.373949 IP 178.128.234.189.22 > 162.243.188.66.27289: Flags [P.], seq 79376:79760, ack 1, win 501, options [nop,nop,TS val 1182954215 ecr 612711094], length 384
20:45:38.388363 IP 162.243.188.66.27289 > 178.128.234.189.22: Flags [.], ack 79760, win 4768, options [nop,nop,TS val 612711197 ecr 1182954215], length 0
20:45:38.477962 IP 178.128.234.189.22 > 162.243.188.66.27289: Flags [P.], seq 79760:80144, ack 1, win 501, options [nop,nop,TS val 1182954319 ecr 612711197], length 384
20:45:38.492484 IP 162.243.188.66.27289 > 178.128.234.189.22: Flags [.], ack 80144, win 4768, options [nop,nop,TS val 612711301 ecr 1182954319], length 0
20:45:38.581944 IP 178.128.234.189.22 > 162.243.188.66.27289: Flags [P.], seq 80144:80528, ack 1, win 501, options [nop,nop,TS val 1182954423 ecr 612711301], length 384
20:45:38.596732 IP 162.243.188.66.27289 > 178.128.234.189.22: Flags [.], ack 80528, win 4768, options [nop,nop,TS val 612711405 ecr 1182954423], length 0
20:45:38.685960 IP 178.128.234.189.22 > 162.243.188.66.27289: Flags [P.], seq 80528:80912, ack 1, win 501, options [nop,nop,TS val 1182954527 ecr 612711405], length 384
20:45:38.700401 IP 162.243.188.66.27289 > 178.128.234.189.22: Flags [.], ack 80912, win 4768, options [nop,nop,TS val 612711509 ecr 1182954527], length 0
20:45:38.789980 IP 178.128.234.189.22 > 162.243.188.66.27289: Flags [P.], seq 80912:81296, ack 1, win 501, options [nop,nop,TS val 1182954631 ecr 612711509], length 384
20:45:38.804318 IP 162.243.188.66.27289 > 178.128.234.189.22: Flags [.], ack 81296, win 4768, options [nop,nop,TS val 612711613 ecr 1182954631], length 0
20:45:38.875369 IP 68.183.20.84.56886 > 178.128.234.189.22: Flags [S], seq 3172394104, win 64240, options [mss 1460,sackOK,TS val 2921034468 ecr 0,nop,wscale 7], length 0
20:45:38.875454 IP 178.128.234.189.22 > 68.183.20.84.56886: Flags [S.], seq 2821737138, ack 3172394105, win 65160, options [mss 1460,sackOK,TS val 1976384545 ecr 2921034468,nop,wscale 7], length 0
20:45:38.888353 IP 68.183.20.84.56886 > 178.128.234.189.22: Flags [.], ack 1, win 502, options [nop,nop,TS val 2921034482 ecr 1976384545], length 0
20:45:38.888353 IP 68.183.20.84.56886 > 178.128.234.189.22: Flags [P.], seq 1:23, ack 1, win 502, options [nop,nop,TS val 2921034482 ecr 1976384545], length 22: SSH: SSH-2.0-libssh_0.9.6
20:45:38.888452 IP 178.128.234.189.22 > 68.183.20.84.56886: Flags [.], ack 23, win 509, options [nop,nop,TS val 1976384558 ecr 2921034482], length 0
20:45:38.893989 IP 178.128.234.189.22 > 162.243.188.66.27289: Flags [P.], seq 81296:82528, ack 1, win 501, options [nop,nop,TS val 1182954735 ecr 612711613], length 1232
20:45:38.899485 IP 178.128.234.189.22 > 68.183.20.84.56886: Flags [P.], seq 1:43, ack 23, win 509, options [nop,nop,TS val 1976384569 ecr 2921034482], length 42: SSH: SSH-2.0-OpenSSH_8.9p1 Ubuntu-3ubuntu0.10
20:45:38.910767 IP 68.183.20.84.56886 > 178.128.234.189.22: Flags [.], ack 43, win 502, options [nop,nop,TS val 2921034504 ecr 1976384569], length 0
20:45:38.910819 IP 178.128.234.189.22 > 68.183.20.84.56886: Flags [P.], seq 43:1155, ack 23, win 509, options [nop,nop,TS val 1976384581 ecr 2921034504], length 1112
20:45:38.910837 IP 68.183.20.84.56886 > 178.128.234.189.22: Flags [P.], seq 23:999, ack 43, win 502, options [nop,nop,TS val 2921034504 ecr 1976384569], length 976
20:45:38.950268 IP 162.243.188.66.27289 > 178.128.234.189.22: Flags [.], ack 82528, win 4768, options [nop,nop,TS val 612711759 ecr 1182954735], length 0
20:45:38.953772 IP 178.128.234.189.22 > 68.183.20.84.56886: Flags [.], ack 999, win 502, options [nop,nop,TS val 1976384624 ecr 2921034504], length 0
20:45:38.963146 IP 68.183.20.84.56886 > 178.128.234.189.22: Flags [.], ack 1155, win 501, options [nop,nop,TS val 2921034557 ecr 1976384581], length 0
20:45:38.965177 IP 68.183.20.84.56886 > 178.128.234.189.22: Flags [P.], seq 999:1047, ack 1155, win 501, options [nop,nop,TS val 2921034559 ecr 1976384624], length 48
20:45:38.965213 IP 178.128.234.189.22 > 68.183.20.84.56886: Flags [.], ack 1047, win 502, options [nop,nop,TS val 1976384635 ecr 2921034559], length 0
20:45:38.971611 IP 178.128.234.189.22 > 68.183.20.84.56886: Flags [P.], seq 1155:1687, ack 1047, win 502, options [nop,nop,TS val 1976384641 ecr 2921034559], length 532
20:45:38.982807 IP 68.183.20.84.56886 > 178.128.234.189.22: Flags [.], ack 1687, win 501, options [nop,nop,TS val 2921034576 ecr 1976384641], length 0
20:45:38.983185 IP 68.183.20.84.56886 > 178.128.234.189.22: Flags [P.], seq 1047:1063, ack 1687, win 501, options [nop,nop,TS val 2921034577 ecr 1976384641], length 16
20:45:38.998068 IP 178.128.234.189.22 > 162.243.188.66.27289: Flags [P.], seq 82528:84720, ack 1, win 501, options [nop,nop,TS val 1182954839 ecr 612711759], length 2192
20:45:39.011298 IP 162.243.188.66.27289 > 178.128.234.189.22: Flags [.], ack 84720, win 4768, options [nop,nop,TS val 612711820 ecr 1182954839], length 0
20:45:39.025792 IP 178.128.234.189.22 > 68.183.20.84.56886: Flags [.], ack 1063, win 502, options [nop,nop,TS val 1976384696 ecr 2921034577], length 0
20:45:39.037073 IP 68.183.20.84.56886 > 178.128.234.189.22: Flags [P.], seq 1063:1115, ack 1687, win 501, options [nop,nop,TS val 2921034630 ecr 1976384696], length 52
20:45:39.037117 IP 178.128.234.189.22 > 68.183.20.84.56886: Flags [.], ack 1115, win 502, options [nop,nop,TS val 1976384707 ecr 2921034630], length 0
20:45:39.037226 IP 178.128.234.189.22 > 68.183.20.84.56886: Flags [P.], seq 1687:1739, ack 1115, win 502, options [nop,nop,TS val 1976384707 ecr 2921034630], length 52
20:45:39.048605 IP 68.183.20.84.56886 > 178.128.234.189.22: Flags [P.], seq 1115:1199, ack 1739, win 501, options [nop,nop,TS val 2921034642 ecr 1976384707], length 84
20:45:39.089769 IP 178.128.234.189.22 > 68.183.20.84.56886: Flags [.], ack 1199, win 502, options [nop,nop,TS val 1976384760 ecr 2921034642], length 0
20:45:39.102084 IP 178.128.234.189.22 > 162.243.188.66.27289: Flags [P.], seq 84720:86064, ack 1, win 501, options [nop,nop,TS val 1182954943 ecr 612711820], length 1344
20:45:39.122779 IP 162.243.188.66.27289 > 178.128.234.189.22: Flags [.], ack 86064, win 4768, options [nop,nop,TS val 612711931 ecr 1182954943], length 0
20:45:39.205997 IP 178.128.234.189.22 > 162.243.188.66.27289: Flags [P.], seq 86064:86448, ack 1, win 501, options [nop,nop,TS val 1182955047 ecr 612711931], length 384
20:45:39.222393 IP 162.243.188.66.27289 > 178.128.234.189.22: Flags [.], ack 86448, win 4768, options [nop,nop,TS val 612712031 ecr 1182955047], length 0
20:45:39.309983 IP 178.128.234.189.22 > 162.243.188.66.27289: Flags [P.], seq 86448:86832, ack 1, win 501, options [nop,nop,TS val 1182955151 ecr 612712031], length 384
20:45:39.325943 IP 162.243.188.66.27289 > 178.128.234.189.22: Flags [.], ack 86832, win 4768, options [nop,nop,TS val 612712135 ecr 1182955151], length 0
20:45:39.413967 IP 178.128.234.189.22 > 162.243.188.66.27289: Flags [P.], seq 86832:87216, ack 1, win 501, options [nop,nop,TS val 1182955255 ecr 612712135], length 384
20:45:39.428556 IP 162.243.188.66.27289 > 178.128.234.189.22: Flags [.], ack 87216, win 4768, options [nop,nop,TS val 612712237 ecr 1182955255], length 0
20:45:39.517976 IP 178.128.234.189.22 > 162.243.188.66.27289: Flags [P.], seq 87216:87600, ack 1, win 501, options [nop,nop,TS val 1182955359 ecr 612712237], length 384
20:45:39.533051 IP 162.243.188.66.27289 > 178.128.234.189.22: Flags [.], ack 87600, win 4768, options [nop,nop,TS val 612712342 ecr 1182955359], length 0
20:45:39.622098 IP 178.128.234.189.22 > 162.243.188.66.27289: Flags [P.], seq 87600:87984, ack 1, win 501, options [nop,nop,TS val 1182955463 ecr 612712342], length 384
20:45:39.636793 IP 162.243.188.66.27289 > 178.128.234.189.22: Flags [.], ack 87984, win 4768, options [nop,nop,TS val 612712446 ecr 1182955463], length 0
20:45:39.725976 IP 178.128.234.189.22 > 162.243.188.66.27289: Flags [P.], seq 87984:88368, ack 1, win 501, options [nop,nop,TS val 1182955567 ecr 612712446], length 384
20:45:39.740558 IP 162.243.188.66.27289 > 178.128.234.189.22: Flags [.], ack 88368, win 4768, options [nop,nop,TS val 612712549 ecr 1182955567], length 0
20:45:39.829954 IP 178.128.234.189.22 > 162.243.188.66.27289: Flags [P.], seq 88368:88752, ack 1, win 501, options [nop,nop,TS val 1182955671 ecr 612712549], length 384
20:45:39.845977 IP 162.243.188.66.27289 > 178.128.234.189.22: Flags [.], ack 88752, win 4768, options [nop,nop,TS val 612712655 ecr 1182955671], length 0
20:45:39.934010 IP 178.128.234.189.22 > 162.243.188.66.27289: Flags [P.], seq 88752:89136, ack 1, win 501, options [nop,nop,TS val 1182955775 ecr 612712655], length 384
20:45:39.951424 IP 162.243.188.66.27289 > 178.128.234.189.22: Flags [.], ack 89136, win 4768, options [nop,nop,TS val 612712760 ecr 1182955775], length 0
20:45:40.038036 IP 178.128.234.189.22 > 162.243.188.66.27289: Flags [P.], seq 89136:89520, ack 1, win 501, options [nop,nop,TS val 1182955879 ecr 612712760], length 384
20:45:40.054690 IP 162.243.188.66.27289 > 178.128.234.189.22: Flags [.], ack 89520, win 4768, options [nop,nop,TS val 612712863 ecr 1182955879], length 0
20:45:40.141974 IP 178.128.234.189.22 > 162.243.188.66.27289: Flags [P.], seq 89520:89904, ack 1, win 501, options [nop,nop,TS val 1182955983 ecr 612712863], length 384
20:45:40.158968 IP 162.243.188.66.27289 > 178.128.234.189.22: Flags [.], ack 89904, win 4768, options [nop,nop,TS val 612712968 ecr 1182955983], length 0
20:45:40.245987 IP 178.128.234.189.22 > 162.243.188.66.27289: Flags [P.], seq 89904:90288, ack 1, win 501, options [nop,nop,TS val 1182956087 ecr 612712968], length 384
20:45:40.261563 IP 162.243.188.66.27289 > 178.128.234.189.22: Flags [.], ack 90288, win 4768, options [nop,nop,TS val 612713070 ecr 1182956087], length 0
20:45:40.262296 IP 51.79.65.10.50176 > 178.128.234.189.22: Flags [S], seq 3938941864, win 64240, options [mss 1460,sackOK,TS val 2318050453 ecr 0,nop,wscale 7], length 0
20:45:40.262354 IP 178.128.234.189.22 > 51.79.65.10.50176: Flags [S.], seq 1236427667, ack 3938941865, win 65160, options [mss 1460,sackOK,TS val 3885973162 ecr 2318050453,nop,wscale 7], length 0
20:45:40.270895 IP 51.79.65.10.50176 > 178.128.234.189.22: Flags [.], ack 1, win 502, options [nop,nop,TS val 2318050462 ecr 3885973162], length 0
20:45:40.270896 IP 51.79.65.10.50176 > 178.128.234.189.22: Flags [P.], seq 1:23, ack 1, win 502, options [nop,nop,TS val 2318050462 ecr 3885973162], length 22: SSH: SSH-2.0-libssh_0.9.6
20:45:40.270978 IP 178.128.234.189.22 > 51.79.65.10.50176: Flags [.], ack 23, win 509, options [nop,nop,TS val 3885973171 ecr 2318050462], length 0
20:45:40.282557 IP 178.128.234.189.22 > 51.79.65.10.50176: Flags [P.], seq 1:43, ack 23, win 509, options [nop,nop,TS val 3885973182 ecr 2318050462], length 42: SSH: SSH-2.0-OpenSSH_8.9p1 Ubuntu-3ubuntu0.10
20:45:40.290573 IP 51.79.65.10.50176 > 178.128.234.189.22: Flags [.], ack 43, win 502, options [nop,nop,TS val 2318050482 ecr 3885973182], length 0
20:45:40.290636 IP 178.128.234.189.22 > 51.79.65.10.50176: Flags [P.], seq 43:1155, ack 23, win 509, options [nop,nop,TS val 3885973190 ecr 2318050482], length 1112
20:45:40.290652 IP 51.79.65.10.50176 > 178.128.234.189.22: Flags [P.], seq 23:999, ack 43, win 502, options [nop,nop,TS val 2318050482 ecr 3885973182], length 976
20:45:40.333863 IP 178.128.234.189.22 > 51.79.65.10.50176: Flags [.], ack 999, win 502, options [nop,nop,TS val 3885973234 ecr 2318050482], length 0
20:45:40.341497 IP 51.79.65.10.50176 > 178.128.234.189.22: Flags [.], ack 1155, win 501, options [nop,nop,TS val 2318050533 ecr 3885973190], length 0
20:45:40.341843 IP 51.79.65.10.50176 > 178.128.234.189.22: Flags [P.], seq 999:1047, ack 1155, win 501, options [nop,nop,TS val 2318050533 ecr 3885973234], length 48
20:45:40.341868 IP 178.128.234.189.22 > 51.79.65.10.50176: Flags [.], ack 1047, win 502, options [nop,nop,TS val 3885973242 ecr 2318050533], length 0
20:45:40.350197 IP 178.128.234.189.22 > 162.243.188.66.27289: Flags [P.], seq 90288:92832, ack 1, win 501, options [nop,nop,TS val 1182956191 ecr 612713070], length 2544
20:45:40.350649 IP 178.128.234.189.22 > 51.79.65.10.50176: Flags [P.], seq 1155:1687, ack 1047, win 502, options [nop,nop,TS val 3885973250 ecr 2318050533], length 532
20:45:40.358747 IP 51.79.65.10.50176 > 178.128.234.189.22: Flags [.], ack 1687, win 501, options [nop,nop,TS val 2318050550 ecr 3885973250], length 0
20:45:40.358787 IP 51.79.65.10.50176 > 178.128.234.189.22: Flags [P.], seq 1047:1063, ack 1687, win 501, options [nop,nop,TS val 2318050550 ecr 3885973250], length 16
20:45:40.363267 IP 162.243.188.66.27289 > 178.128.234.189.22: Flags [.], ack 92832, win 4768, options [nop,nop,TS val 612713172 ecr 1182956191], length 0
20:45:40.401765 IP 178.128.234.189.22 > 51.79.65.10.50176: Flags [.], ack 1063, win 502, options [nop,nop,TS val 3885973302 ecr 2318050550], length 0
20:45:40.409793 IP 51.79.65.10.50176 > 178.128.234.189.22: Flags [P.], seq 1063:1115, ack 1687, win 501, options [nop,nop,TS val 2318050601 ecr 3885973302], length 52
20:45:40.409842 IP 178.128.234.189.22 > 51.79.65.10.50176: Flags [.], ack 1115, win 502, options [nop,nop,TS val 3885973310 ecr 2318050601], length 0
20:45:40.409963 IP 178.128.234.189.22 > 51.79.65.10.50176: Flags [P.], seq 1687:1739, ack 1115, win 502, options [nop,nop,TS val 3885973310 ecr 2318050601], length 52
20:45:40.417950 IP 51.79.65.10.50176 > 178.128.234.189.22: Flags [P.], seq 1115:1199, ack 1739, win 501, options [nop,nop,TS val 2318050609 ecr 3885973310], length 84
20:45:40.454168 IP 178.128.234.189.22 > 162.243.188.66.27289: Flags [P.], seq 92832:94512, ack 1, win 501, options [nop,nop,TS val 1182956295 ecr 612713172], length 1680
20:45:40.461770 IP 178.128.234.189.22 > 51.79.65.10.50176: Flags [.], ack 1199, win 502, options [nop,nop,TS val 3885973362 ecr 2318050609], length 0
20:45:40.467334 IP 162.243.188.66.27289 > 178.128.234.189.22: Flags [.], ack 94512, win 4768, options [nop,nop,TS val 612713276 ecr 1182956295], length 0
20:45:40.557988 IP 178.128.234.189.22 > 162.243.188.66.27289: Flags [P.], seq 94512:95040, ack 1, win 501, options [nop,nop,TS val 1182956399 ecr 612713276], length 528
20:45:40.573680 IP 162.243.188.66.27289 > 178.128.234.189.22: Flags [.], ack 95040, win 4768, options [nop,nop,TS val 612713382 ecr 1182956399], length 0
20:45:40.662091 IP 178.128.234.189.22 > 162.243.188.66.27289: Flags [P.], seq 95040:95424, ack 1, win 501, options [nop,nop,TS val 1182956503 ecr 612713382], length 384
20:45:40.676906 IP 162.243.188.66.27289 > 178.128.234.189.22: Flags [.], ack 95424, win 4768, options [nop,nop,TS val 612713486 ecr 1182956503], length 0
20:45:40.766006 IP 178.128.234.189.22 > 162.243.188.66.27289: Flags [P.], seq 95424:95808, ack 1, win 501, options [nop,nop,TS val 1182956607 ecr 612713486], length 384
20:45:40.780892 IP 162.243.188.66.27289 > 178.128.234.189.22: Flags [.], ack 95808, win 4768, options [nop,nop,TS val 612713590 ecr 1182956607], length 0
20:45:40.783789 IP 178.128.234.189.22 > 68.183.20.84.56886: Flags [P.], seq 1739:1791, ack 1199, win 502, options [nop,nop,TS val 1976386454 ecr 2921034642], length 52
20:45:40.795321 IP 68.183.20.84.56886 > 178.128.234.189.22: Flags [P.], seq 1199:1251, ack 1791, win 501, options [nop,nop,TS val 2921036389 ecr 1976386454], length 52
20:45:40.795321 IP 68.183.20.84.56886 > 178.128.234.189.22: Flags [F.], seq 1251, ack 1791, win 501, options [nop,nop,TS val 2921036389 ecr 1976386454], length 0
20:45:40.795438 IP 178.128.234.189.22 > 68.183.20.84.56886: Flags [.], ack 1251, win 502, options [nop,nop,TS val 1976386465 ecr 2921036389], length 0
20:45:40.798041 IP 178.128.234.189.22 > 68.183.20.84.56886: Flags [F.], seq 1791, ack 1252, win 502, options [nop,nop,TS val 1976386468 ecr 2921036389], length 0
20:45:40.809335 IP 68.183.20.84.56886 > 178.128.234.189.22: Flags [.], ack 1792, win 501, options [nop,nop,TS val 2921036403 ecr 1976386468], length 0
20:45:40.870604 IP 178.128.234.189.22 > 162.243.188.66.27289: Flags [P.], seq 95808:97152, ack 1, win 501, options [nop,nop,TS val 1182956711 ecr 612713590], length 1344
20:45:40.888036 IP 162.243.188.66.27289 > 178.128.234.189.22: Flags [.], ack 97152, win 4768, options [nop,nop,TS val 612713697 ecr 1182956711], length 0
20:45:40.974016 IP 178.128.234.189.22 > 162.243.188.66.27289: Flags [P.], seq 97152:97536, ack 1, win 501, options [nop,nop,TS val 1182956815 ecr 612713697], length 384
20:45:40.990650 IP 162.243.188.66.27289 > 178.128.234.189.22: Flags [.], ack 97536, win 4768, options [nop,nop,TS val 612713799 ecr 1182956815], length 0
20:45:41.078016 IP 178.128.234.189.22 > 162.243.188.66.27289: Flags [P.], seq 97536:97920, ack 1, win 501, options [nop,nop,TS val 1182956919 ecr 612713799], length 384
20:45:41.094582 IP 162.243.188.66.27289 > 178.128.234.189.22: Flags [.], ack 97920, win 4768, options [nop,nop,TS val 612713903 ecr 1182956919], length 0
20:45:41.182009 IP 178.128.234.189.22 > 162.243.188.66.27289: Flags [P.], seq 97920:98304, ack 1, win 501, options [nop,nop,TS val 1182957023 ecr 612713903], length 384
20:45:41.196399 IP 162.243.188.66.27289 > 178.128.234.189.22: Flags [.], ack 98304, win 4768, options [nop,nop,TS val 612714005 ecr 1182957023], length 0
20:45:41.286027 IP 178.128.234.189.22 > 162.243.188.66.27289: Flags [P.], seq 98304:98688, ack 1, win 501, options [nop,nop,TS val 1182957127 ecr 612714005], length 384
20:45:41.300630 IP 162.243.188.66.27289 > 178.128.234.189.22: Flags [.], ack 98688, win 4768, options [nop,nop,TS val 612714109 ecr 1182957127], length 0
20:45:41.390014 IP 178.128.234.189.22 > 162.243.188.66.27289: Flags [P.], seq 98688:99072, ack 1, win 501, options [nop,nop,TS val 1182957231 ecr 612714109], length 384
20:45:41.404389 IP 162.243.188.66.27289 > 178.128.234.189.22: Flags [.], ack 99072, win 4768, options [nop,nop,TS val 612714213 ecr 1182957231], length 0
20:45:41.493969 IP 178.128.234.189.22 > 162.243.188.66.27289: Flags [P.], seq 99072:99456, ack 1, win 501, options [nop,nop,TS val 1182957335 ecr 612714213], length 384
20:45:41.513121 IP 162.243.188.66.27289 > 178.128.234.189.22: Flags [.], ack 99456, win 4768, options [nop,nop,TS val 612714322 ecr 1182957335], length 0
20:45:41.597914 IP 178.128.234.189.22 > 162.243.188.66.27289: Flags [P.], seq 99456:99840, ack 1, win 501, options [nop,nop,TS val 1182957439 ecr 612714322], length 384
20:45:41.614422 IP 162.243.188.66.27289 > 178.128.234.189.22: Flags [.], ack 99840, win 4768, options [nop,nop,TS val 612714423 ecr 1182957439], length 0
20:45:41.702044 IP 178.128.234.189.22 > 162.243.188.66.27289: Flags [P.], seq 99840:100224, ack 1, win 501, options [nop,nop,TS val 1182957543 ecr 612714423], length 384
20:45:41.718450 IP 162.243.188.66.27289 > 178.128.234.189.22: Flags [.], ack 100224, win 4768, options [nop,nop,TS val 612714527 ecr 1182957543], length 0
20:45:41.806001 IP 178.128.234.189.22 > 162.243.188.66.27289: Flags [P.], seq 100224:100608, ack 1, win 501, options [nop,nop,TS val 1182957647 ecr 612714527], length 384
20:45:41.821559 IP 162.243.188.66.27289 > 178.128.234.189.22: Flags [.], ack 100608, win 4768, options [nop,nop,TS val 612714630 ecr 1182957647], length 0
20:45:41.909974 IP 178.128.234.189.22 > 162.243.188.66.27289: Flags [P.], seq 100608:100992, ack 1, win 501, options [nop,nop,TS val 1182957751 ecr 612714630], length 384
20:45:41.924386 IP 162.243.188.66.27289 > 178.128.234.189.22: Flags [.], ack 100992, win 4768, options [nop,nop,TS val 612714733 ecr 1182957751], length 0
20:45:42.013951 IP 178.128.234.189.22 > 162.243.188.66.27289: Flags [P.], seq 100992:101376, ack 1, win 501, options [nop,nop,TS val 1182957855 ecr 612714733], length 384
20:45:42.031285 IP 162.243.188.66.27289 > 178.128.234.189.22: Flags [.], ack 101376, win 4768, options [nop,nop,TS val 612714840 ecr 1182957855], length 0
^C
485 packets captured
491 packets received by filter
0 packets dropped by kernel
root@lamp-ubuntu-s-1vcpu-1gb-tor1-01:~# 