root@lamp-ubuntu-s-1vcpu-1gb-tor1-01:~# tcpdump -i eth0 port 22
tcpdump: verbose output suppressed, use -v[v]... for full protocol decode
listening on eth0, link-type EN10MB (Ethernet), snapshot length 262144 bytes
20:48:43.199536 IP lamp-ubuntu-s-1vcpu-1gb-tor1-01.ssh > 162.243.188.66.27289: Flags [P.], seq 2175999467:2175999595, ack 2913648893, win 501, options [nop,nop,TS val 1183139040 ecr 612896000], length 128
20:48:43.199631 IP lamp-ubuntu-s-1vcpu-1gb-tor1-01.ssh > 162.243.188.66.27289: Flags [P.], seq 128:272, ack 1, win 501, options [nop,nop,TS val 1183139040 ecr 612896000], length 144
20:48:43.199800 IP lamp-ubuntu-s-1vcpu-1gb-tor1-01.ssh > 162.243.188.66.27289: Flags [P.], seq 272:496, ack 1, win 501, options [nop,nop,TS val 1183139041 ecr 612896000], length 224
20:48:43.207279 IP 162.243.188.66.27289 > lamp-ubuntu-s-1vcpu-1gb-tor1-01.ssh: Flags [.], ack 0, win 4768, options [nop,nop,TS val 612896016 ecr 1183139035], length 0
20:48:43.212782 IP 162.243.188.66.27289 > lamp-ubuntu-s-1vcpu-1gb-tor1-01.ssh: Flags [.], ack 128, win 4768, options [nop,nop,TS val 612896022 ecr 1183139040], length 0
20:48:43.212783 IP 162.243.188.66.27289 > lamp-ubuntu-s-1vcpu-1gb-tor1-01.ssh: Flags [.], ack 272, win 4768, options [nop,nop,TS val 612896022 ecr 1183139040], length 0
20:48:43.212783 IP 162.243.188.66.27289 > lamp-ubuntu-s-1vcpu-1gb-tor1-01.ssh: Flags [.], ack 496, win 4768, options [nop,nop,TS val 612896022 ecr 1183139041], length 0
20:48:43.306267 IP lamp-ubuntu-s-1vcpu-1gb-tor1-01.ssh > 162.243.188.66.27289: Flags [P.], seq 496:752, ack 1, win 501, options [nop,nop,TS val 1183139147 ecr 612896022], length 256
20:48:43.306377 IP lamp-ubuntu-s-1vcpu-1gb-tor1-01.ssh > 162.243.188.66.27289: Flags [P.], seq 752:1056, ack 1, win 501, options [nop,nop,TS val 1183139147 ecr 612896022], length 304
20:48:43.306447 IP lamp-ubuntu-s-1vcpu-1gb-tor1-01.ssh > 162.243.188.66.27289: Flags [P.], seq 1056:1360, ack 1, win 501, options [nop,nop,TS val 1183139147 ecr 612896022], length 304
20:48:43.306574 IP lamp-ubuntu-s-1vcpu-1gb-tor1-01.ssh > 162.243.188.66.27289: Flags [P.], seq 1360:1712, ack 1, win 501, options [nop,nop,TS val 1183139147 ecr 612896022], length 352
20:48:43.306620 IP lamp-ubuntu-s-1vcpu-1gb-tor1-01.ssh > 162.243.188.66.27289: Flags [P.], seq 1712:1936, ack 1, win 501, options [nop,nop,TS val 1183139147 ecr 612896022], length 224
20:48:43.306654 IP lamp-ubuntu-s-1vcpu-1gb-tor1-01.ssh > 162.243.188.66.27289: Flags [P.], seq 1936:2000, ack 1, win 501, options [nop,nop,TS val 1183139147 ecr 612896022], length 64
20:48:43.306709 IP lamp-ubuntu-s-1vcpu-1gb-tor1-01.ssh > 162.243.188.66.27289: Flags [P.], seq 2000:2224, ack 1, win 501, options [nop,nop,TS val 1183139148 ecr 612896022], length 224
20:48:43.306738 IP lamp-ubuntu-s-1vcpu-1gb-tor1-01.ssh > 162.243.188.66.27289: Flags [P.], seq 2224:2288, ack 1, win 501, options [nop,nop,TS val 1183139148 ecr 612896022], length 64
20:48:43.306778 IP lamp-ubuntu-s-1vcpu-1gb-tor1-01.ssh > 162.243.188.66.27289: Flags [P.], seq 2288:2512, ack 1, win 501, options [nop,nop,TS val 1183139148 ecr 612896022], length 224
20:48:43.306806 IP lamp-ubuntu-s-1vcpu-1gb-tor1-01.ssh > 162.243.188.66.27289: Flags [P.], seq 2512:2576, ack 1, win 501, options [nop,nop,TS val 1183139148 ecr 612896022], length 64
20:48:43.319516 IP 162.243.188.66.27289 > lamp-ubuntu-s-1vcpu-1gb-tor1-01.ssh: Flags [.], ack 752, win 4768, options [nop,nop,TS val 612896128 ecr 1183139147], length 0
20:48:43.319516 IP 162.243.188.66.27289 > lamp-ubuntu-s-1vcpu-1gb-tor1-01.ssh: Flags [.], ack 1056, win 4768, options [nop,nop,TS val 612896128 ecr 1183139147], length 0
20:48:43.319566 IP 162.243.188.66.27289 > lamp-ubuntu-s-1vcpu-1gb-tor1-01.ssh: Flags [.], ack 1360, win 4768, options [nop,nop,TS val 612896128 ecr 1183139147], length 0
20:48:43.319567 IP 162.243.188.66.27289 > lamp-ubuntu-s-1vcpu-1gb-tor1-01.ssh: Flags [.], ack 1712, win 4768, options [nop,nop,TS val 612896128 ecr 1183139147], length 0
20:48:43.319567 IP 162.243.188.66.27289 > lamp-ubuntu-s-1vcpu-1gb-tor1-01.ssh: Flags [.], ack 1936, win 4768, options [nop,nop,TS val 612896128 ecr 1183139147], length 0
20:48:43.319625 IP 162.243.188.66.27289 > lamp-ubuntu-s-1vcpu-1gb-tor1-01.ssh: Flags [.], ack 2000, win 4768, options [nop,nop,TS val 612896129 ecr 1183139147], length 0
20:48:43.319666 IP 162.243.188.66.27289 > lamp-ubuntu-s-1vcpu-1gb-tor1-01.ssh: Flags [.], ack 2224, win 4768, options [nop,nop,TS val 612896129 ecr 1183139148], length 0
20:48:43.319686 IP 162.243.188.66.27289 > lamp-ubuntu-s-1vcpu-1gb-tor1-01.ssh: Flags [.], ack 2288, win 4768, options [nop,nop,TS val 612896129 ecr 1183139148], length 0
20:48:43.319712 IP 162.243.188.66.27289 > lamp-ubuntu-s-1vcpu-1gb-tor1-01.ssh: Flags [.], ack 2512, win 4768, options [nop,nop,TS val 612896129 ecr 1183139148], length 0
20:48:43.319723 IP 162.243.188.66.27289 > lamp-ubuntu-s-1vcpu-1gb-tor1-01.ssh: Flags [.], ack 2576, win 4768, options [nop,nop,TS val 612896129 ecr 1183139148], length 0
20:48:43.402049 IP lamp-ubuntu-s-1vcpu-1gb-tor1-01.ssh > 162.243.188.66.27289: Flags [P.], seq 2576:2816, ack 1, win 501, options [nop,nop,TS val 1183139243 ecr 612896129], length 240
20:48:43.402165 IP lamp-ubuntu-s-1vcpu-1gb-tor1-01.ssh > 162.243.188.66.27289: Flags [P.], seq 2816:3120, ack 1, win 501, options [nop,nop,TS val 1183139243 ecr 612896129], length 304
20:48:43.402312 IP lamp-ubuntu-s-1vcpu-1gb-tor1-01.ssh > 162.243.188.66.27289: Flags [P.], seq 3120:3728, ack 1, win 501, options [nop,nop,TS val 1183139243 ecr 612896129], length 608
20:48:43.402463 IP lamp-ubuntu-s-1vcpu-1gb-tor1-01.ssh > 162.243.188.66.27289: Flags [P.], seq 3728:4400, ack 1, win 501, options [nop,nop,TS val 1183139243 ecr 612896129], length 672
20:48:43.402523 IP lamp-ubuntu-s-1vcpu-1gb-tor1-01.ssh > 162.243.188.66.27289: Flags [P.], seq 4400:4640, ack 1, win 501, options [nop,nop,TS val 1183139243 ecr 612896129], length 240
20:48:43.402563 IP lamp-ubuntu-s-1vcpu-1gb-tor1-01.ssh > 162.243.188.66.27289: Flags [P.], seq 4640:4704, ack 1, win 501, options [nop,nop,TS val 1183139243 ecr 612896129], length 64
20:48:43.402617 IP lamp-ubuntu-s-1vcpu-1gb-tor1-01.ssh > 162.243.188.66.27289: Flags [P.], seq 4704:4944, ack 1, win 501, options [nop,nop,TS val 1183139243 ecr 612896129], length 240
20:48:43.402653 IP lamp-ubuntu-s-1vcpu-1gb-tor1-01.ssh > 162.243.188.66.27289: Flags [P.], seq 4944:5008, ack 1, win 501, options [nop,nop,TS val 1183139243 ecr 612896129], length 64
20:48:43.402704 IP lamp-ubuntu-s-1vcpu-1gb-tor1-01.ssh > 162.243.188.66.27289: Flags [P.], seq 5008:5248, ack 1, win 501, options [nop,nop,TS val 1183139244 ecr 612896129], length 240
20:48:43.402732 IP lamp-ubuntu-s-1vcpu-1gb-tor1-01.ssh > 162.243.188.66.27289: Flags [P.], seq 5248:5312, ack 1, win 501, options [nop,nop,TS val 1183139244 ecr 612896129], length 64
20:48:43.402778 IP lamp-ubuntu-s-1vcpu-1gb-tor1-01.ssh > 162.243.188.66.27289: Flags [P.], seq 5312:5552, ack 1, win 501, options [nop,nop,TS val 1183139244 ecr 612896129], length 240
20:48:43.402814 IP lamp-ubuntu-s-1vcpu-1gb-tor1-01.ssh > 162.243.188.66.27289: Flags [P.], seq 5552:5616, ack 1, win 501, options [nop,nop,TS val 1183139244 ecr 612896129], length 64
20:48:43.402863 IP lamp-ubuntu-s-1vcpu-1gb-tor1-01.ssh > 162.243.188.66.27289: Flags [P.], seq 5616:5840, ack 1, win 501, options [nop,nop,TS val 1183139244 ecr 612896129], length 224
20:48:43.402895 IP lamp-ubuntu-s-1vcpu-1gb-tor1-01.ssh > 162.243.188.66.27289: Flags [P.], seq 5840:5904, ack 1, win 501, options [nop,nop,TS val 1183139244 ecr 612896129], length 64
20:48:43.402934 IP lamp-ubuntu-s-1vcpu-1gb-tor1-01.ssh > 162.243.188.66.27289: Flags [P.], seq 5904:6128, ack 1, win 501, options [nop,nop,TS val 1183139244 ecr 612896129], length 224
20:48:43.402961 IP lamp-ubuntu-s-1vcpu-1gb-tor1-01.ssh > 162.243.188.66.27289: Flags [P.], seq 6128:6192, ack 1, win 501, options [nop,nop,TS val 1183139244 ecr 612896129], length 64
20:48:43.403007 IP lamp-ubuntu-s-1vcpu-1gb-tor1-01.ssh > 162.243.188.66.27289: Flags [P.], seq 6192:6416, ack 1, win 501, options [nop,nop,TS val 1183139244 ecr 612896129], length 224
20:48:43.403040 IP lamp-ubuntu-s-1vcpu-1gb-tor1-01.ssh > 162.243.188.66.27289: Flags [P.], seq 6416:6480, ack 1, win 501, options [nop,nop,TS val 1183139244 ecr 612896129], length 64
20:48:43.403079 IP lamp-ubuntu-s-1vcpu-1gb-tor1-01.ssh > 162.243.188.66.27289: Flags [P.], seq 6480:6704, ack 1, win 501, options [nop,nop,TS val 1183139244 ecr 612896129], length 224
20:48:43.403109 IP lamp-ubuntu-s-1vcpu-1gb-tor1-01.ssh > 162.243.188.66.27289: Flags [P.], seq 6704:6768, ack 1, win 501, options [nop,nop,TS val 1183139244 ecr 612896129], length 64
20:48:43.415469 IP 162.243.188.66.27289 > lamp-ubuntu-s-1vcpu-1gb-tor1-01.ssh: Flags [.], ack 2816, win 4768, options [nop,nop,TS val 612896224 ecr 1183139243], length 0
20:48:43.415469 IP 162.243.188.66.27289 > lamp-ubuntu-s-1vcpu-1gb-tor1-01.ssh: Flags [.], ack 3120, win 4768, options [nop,nop,TS val 612896224 ecr 1183139243], length 0
20:48:43.415530 IP lamp-ubuntu-s-1vcpu-1gb-tor1-01.ssh > 162.243.188.66.27289: Flags [P.], seq 6768:8496, ack 1, win 501, options [nop,nop,TS val 1183139256 ecr 612896224], length 1728
20:48:43.415607 IP 162.243.188.66.27289 > lamp-ubuntu-s-1vcpu-1gb-tor1-01.ssh: Flags [.], ack 4640, win 4768, options [nop,nop,TS val 612896224 ecr 1183139243], length 0
20:48:43.415956 IP 162.243.188.66.27289 > lamp-ubuntu-s-1vcpu-1gb-tor1-01.ssh: Flags [.], ack 6128, win 4768, options [nop,nop,TS val 612896225 ecr 1183139243], length 0
20:48:43.428739 IP 162.243.188.66.27289 > lamp-ubuntu-s-1vcpu-1gb-tor1-01.ssh: Flags [.], ack 8216, win 4768, options [nop,nop,TS val 612896237 ecr 1183139244], length 0
20:48:43.445325 IP 162.243.188.66.27289 > lamp-ubuntu-s-1vcpu-1gb-tor1-01.ssh: Flags [.], ack 8496, win 4768, options [nop,nop,TS val 612896254 ecr 1183139256], length 0
20:48:43.505955 IP lamp-ubuntu-s-1vcpu-1gb-tor1-01.ssh > 162.243.188.66.27289: Flags [P.], seq 8496:8736, ack 1, win 501, options [nop,nop,TS val 1183139347 ecr 612896254], length 240
20:48:43.506038 IP lamp-ubuntu-s-1vcpu-1gb-tor1-01.ssh > 162.243.188.66.27289: Flags [P.], seq 8736:9040, ack 1, win 501, options [nop,nop,TS val 1183139347 ecr 612896254], length 304
20:48:43.506146 IP lamp-ubuntu-s-1vcpu-1gb-tor1-01.ssh > 162.243.188.66.27289: Flags [P.], seq 9040:9648, ack 1, win 501, options [nop,nop,TS val 1183139347 ecr 612896254], length 608
20:48:43.506167 IP lamp-ubuntu-s-1vcpu-1gb-tor1-01.ssh > 162.243.188.66.27289: Flags [P.], seq 9648:9712, ack 1, win 501, options [nop,nop,TS val 1183139347 ecr 612896254], length 64
20:48:43.506206 IP lamp-ubuntu-s-1vcpu-1gb-tor1-01.ssh > 162.243.188.66.27289: Flags [P.], seq 9712:9952, ack 1, win 501, options [nop,nop,TS val 1183139347 ecr 612896254], length 240
20:48:43.506234 IP lamp-ubuntu-s-1vcpu-1gb-tor1-01.ssh > 162.243.188.66.27289: Flags [P.], seq 9952:10016, ack 1, win 501, options [nop,nop,TS val 1183139347 ecr 612896254], length 64
20:48:43.506278 IP lamp-ubuntu-s-1vcpu-1gb-tor1-01.ssh > 162.243.188.66.27289: Flags [P.], seq 10016:10256, ack 1, win 501, options [nop,nop,TS val 1183139347 ecr 612896254], length 240
20:48:43.506317 IP lamp-ubuntu-s-1vcpu-1gb-tor1-01.ssh > 162.243.188.66.27289: Flags [P.], seq 10256:10320, ack 1, win 501, options [nop,nop,TS val 1183139347 ecr 612896254], length 64
20:48:43.506359 IP lamp-ubuntu-s-1vcpu-1gb-tor1-01.ssh > 162.243.188.66.27289: Flags [P.], seq 10320:10560, ack 1, win 501, options [nop,nop,TS val 1183139347 ecr 612896254], length 240
20:48:43.506386 IP lamp-ubuntu-s-1vcpu-1gb-tor1-01.ssh > 162.243.188.66.27289: Flags [P.], seq 10560:10624, ack 1, win 501, options [nop,nop,TS val 1183139347 ecr 612896254], length 64
20:48:43.506424 IP lamp-ubuntu-s-1vcpu-1gb-tor1-01.ssh > 162.243.188.66.27289: Flags [P.], seq 10624:10864, ack 1, win 501, options [nop,nop,TS val 1183139347 ecr 612896254], length 240
20:48:43.506451 IP lamp-ubuntu-s-1vcpu-1gb-tor1-01.ssh > 162.243.188.66.27289: Flags [P.], seq 10864:10928, ack 1, win 501, options [nop,nop,TS val 1183139347 ecr 612896254], length 64
20:48:43.506488 IP lamp-ubuntu-s-1vcpu-1gb-tor1-01.ssh > 162.243.188.66.27289: Flags [P.], seq 10928:11168, ack 1, win 501, options [nop,nop,TS val 1183139347 ecr 612896254], length 240
20:48:43.506519 IP lamp-ubuntu-s-1vcpu-1gb-tor1-01.ssh > 162.243.188.66.27289: Flags [P.], seq 11168:11232, ack 1, win 501, options [nop,nop,TS val 1183139347 ecr 612896254], length 64
20:48:43.506610 IP lamp-ubuntu-s-1vcpu-1gb-tor1-01.ssh > 162.243.188.66.27289: Flags [P.], seq 11232:11472, ack 1, win 501, options [nop,nop,TS val 1183139347 ecr 612896254], length 240
20:48:43.506645 IP lamp-ubuntu-s-1vcpu-1gb-tor1-01.ssh > 162.243.188.66.27289: Flags [P.], seq 11472:11536, ack 1, win 501, options [nop,nop,TS val 1183139347 ecr 612896254], length 64
20:48:43.506687 IP lamp-ubuntu-s-1vcpu-1gb-tor1-01.ssh > 162.243.188.66.27289: Flags [P.], seq 11536:11776, ack 1, win 501, options [nop,nop,TS val 1183139347 ecr 612896254], length 240
20:48:43.506715 IP lamp-ubuntu-s-1vcpu-1gb-tor1-01.ssh > 162.243.188.66.27289: Flags [P.], seq 11776:11840, ack 1, win 501, options [nop,nop,TS val 1183139348 ecr 612896254], length 64
20:48:43.506753 IP lamp-ubuntu-s-1vcpu-1gb-tor1-01.ssh > 162.243.188.66.27289: Flags [P.], seq 11840:12080, ack 1, win 501, options [nop,nop,TS val 1183139348 ecr 612896254], length 240
20:48:43.506780 IP lamp-ubuntu-s-1vcpu-1gb-tor1-01.ssh > 162.243.188.66.27289: Flags [P.], seq 12080:12144, ack 1, win 501, options [nop,nop,TS val 1183139348 ecr 612896254], length 64
20:48:43.506832 IP lamp-ubuntu-s-1vcpu-1gb-tor1-01.ssh > 162.243.188.66.27289: Flags [P.], seq 12144:12384, ack 1, win 501, options [nop,nop,TS val 1183139348 ecr 612896254], length 240
20:48:43.506859 IP lamp-ubuntu-s-1vcpu-1gb-tor1-01.ssh > 162.243.188.66.27289: Flags [P.], seq 12384:12448, ack 1, win 501, options [nop,nop,TS val 1183139348 ecr 612896254], length 64
20:48:43.506896 IP lamp-ubuntu-s-1vcpu-1gb-tor1-01.ssh > 162.243.188.66.27289: Flags [P.], seq 12448:12688, ack 1, win 501, options [nop,nop,TS val 1183139348 ecr 612896254], length 240
20:48:43.506923 IP lamp-ubuntu-s-1vcpu-1gb-tor1-01.ssh > 162.243.188.66.27289: Flags [P.], seq 12688:12752, ack 1, win 501, options [nop,nop,TS val 1183139348 ecr 612896254], length 64
20:48:43.506961 IP lamp-ubuntu-s-1vcpu-1gb-tor1-01.ssh > 162.243.188.66.27289: Flags [P.], seq 12752:12992, ack 1, win 501, options [nop,nop,TS val 1183139348 ecr 612896254], length 240
20:48:43.506990 IP lamp-ubuntu-s-1vcpu-1gb-tor1-01.ssh > 162.243.188.66.27289: Flags [P.], seq 12992:13056, ack 1, win 501, options [nop,nop,TS val 1183139348 ecr 612896254], length 64
20:48:43.507027 IP lamp-ubuntu-s-1vcpu-1gb-tor1-01.ssh > 162.243.188.66.27289: Flags [P.], seq 13056:13296, ack 1, win 501, options [nop,nop,TS val 1183139348 ecr 612896254], length 240
20:48:43.507053 IP lamp-ubuntu-s-1vcpu-1gb-tor1-01.ssh > 162.243.188.66.27289: Flags [P.], seq 13296:13360, ack 1, win 501, options [nop,nop,TS val 1183139348 ecr 612896254], length 64
20:48:43.507090 IP lamp-ubuntu-s-1vcpu-1gb-tor1-01.ssh > 162.243.188.66.27289: Flags [P.], seq 13360:13600, ack 1, win 501, options [nop,nop,TS val 1183139348 ecr 612896254], length 240
20:48:43.507116 IP lamp-ubuntu-s-1vcpu-1gb-tor1-01.ssh > 162.243.188.66.27289: Flags [P.], seq 13600:13664, ack 1, win 501, options [nop,nop,TS val 1183139348 ecr 612896254], length 64
20:48:43.507152 IP lamp-ubuntu-s-1vcpu-1gb-tor1-01.ssh > 162.243.188.66.27289: Flags [P.], seq 13664:13904, ack 1, win 501, options [nop,nop,TS val 1183139348 ecr 612896254], length 240
20:48:43.507183 IP lamp-ubuntu-s-1vcpu-1gb-tor1-01.ssh > 162.243.188.66.27289: Flags [P.], seq 13904:13968, ack 1, win 501, options [nop,nop,TS val 1183139348 ecr 612896254], length 64
20:48:43.507231 IP lamp-ubuntu-s-1vcpu-1gb-tor1-01.ssh > 162.243.188.66.27289: Flags [P.], seq 13968:14208, ack 1, win 501, options [nop,nop,TS val 1183139348 ecr 612896254], length 240
20:48:43.507270 IP lamp-ubuntu-s-1vcpu-1gb-tor1-01.ssh > 162.243.188.66.27289: Flags [P.], seq 14208:14272, ack 1, win 501, options [nop,nop,TS val 1183139348 ecr 612896254], length 64
20:48:43.507315 IP lamp-ubuntu-s-1vcpu-1gb-tor1-01.ssh > 162.243.188.66.27289: Flags [P.], seq 14272:14512, ack 1, win 501, options [nop,nop,TS val 1183139348 ecr 612896254], length 240
20:48:43.507342 IP lamp-ubuntu-s-1vcpu-1gb-tor1-01.ssh > 162.243.188.66.27289: Flags [P.], seq 14512:14576, ack 1, win 501, options [nop,nop,TS val 1183139348 ecr 612896254], length 64
20:48:43.507380 IP lamp-ubuntu-s-1vcpu-1gb-tor1-01.ssh > 162.243.188.66.27289: Flags [P.], seq 14576:14800, ack 1, win 501, options [nop,nop,TS val 1183139348 ecr 612896254], length 224
20:48:43.507407 IP lamp-ubuntu-s-1vcpu-1gb-tor1-01.ssh > 162.243.188.66.27289: Flags [P.], seq 14800:14864, ack 1, win 501, options [nop,nop,TS val 1183139348 ecr 612896254], length 64
20:48:43.507442 IP lamp-ubuntu-s-1vcpu-1gb-tor1-01.ssh > 162.243.188.66.27289: Flags [P.], seq 14864:15088, ack 1, win 501, options [nop,nop,TS val 1183139348 ecr 612896254], length 224
20:48:43.507470 IP lamp-ubuntu-s-1vcpu-1gb-tor1-01.ssh > 162.243.188.66.27289: Flags [P.], seq 15088:15152, ack 1, win 501, options [nop,nop,TS val 1183139348 ecr 612896254], length 64
20:48:43.507508 IP lamp-ubuntu-s-1vcpu-1gb-tor1-01.ssh > 162.243.188.66.27289: Flags [P.], seq 15152:15392, ack 1, win 501, options [nop,nop,TS val 1183139348 ecr 612896254], length 240
20:48:43.507535 IP lamp-ubuntu-s-1vcpu-1gb-tor1-01.ssh > 162.243.188.66.27289: Flags [P.], seq 15392:15456, ack 1, win 501, options [nop,nop,TS val 1183139348 ecr 612896254], length 64
20:48:43.519223 IP 162.243.188.66.27289 > lamp-ubuntu-s-1vcpu-1gb-tor1-01.ssh: Flags [.], ack 9952, win 4768, options [nop,nop,TS val 612896328 ecr 1183139347], length 0
20:48:43.519309 IP lamp-ubuntu-s-1vcpu-1gb-tor1-01.ssh > 162.243.188.66.27289: Flags [P.], seq 15456:16608, ack 1, win 501, options [nop,nop,TS val 1183139360 ecr 612896328], length 1152
20:48:43.519565 IP 162.243.188.66.27289 > lamp-ubuntu-s-1vcpu-1gb-tor1-01.ssh: Flags [.], ack 11472, win 4768, options [nop,nop,TS val 612896328 ecr 1183139347], length 0
20:48:43.519910 IP 162.243.188.66.27289 > lamp-ubuntu-s-1vcpu-1gb-tor1-01.ssh: Flags [.], ack 12992, win 4768, options [nop,nop,TS val 612896329 ecr 1183139347], length 0
20:48:43.520328 IP 162.243.188.66.27289 > lamp-ubuntu-s-1vcpu-1gb-tor1-01.ssh: Flags [.], ack 14512, win 4768, options [nop,nop,TS val 612896329 ecr 1183139348], length 0
20:48:43.532599 IP 162.243.188.66.27289 > lamp-ubuntu-s-1vcpu-1gb-tor1-01.ssh: Flags [.], ack 16608, win 4768, options [nop,nop,TS val 612896341 ecr 1183139348], length 0
20:48:43.609940 IP lamp-ubuntu-s-1vcpu-1gb-tor1-01.ssh > 162.243.188.66.27289: Flags [P.], seq 16608:16848, ack 1, win 501, options [nop,nop,TS val 1183139451 ecr 612896341], length 240
20:48:43.610001 IP lamp-ubuntu-s-1vcpu-1gb-tor1-01.ssh > 162.243.188.66.27289: Flags [P.], seq 16848:16912, ack 1, win 501, options [nop,nop,TS val 1183139451 ecr 612896341], length 64
20:48:43.610054 IP lamp-ubuntu-s-1vcpu-1gb-tor1-01.ssh > 162.243.188.66.27289: Flags [P.], seq 16912:17152, ack 1, win 501, options [nop,nop,TS val 1183139451 ecr 612896341], length 240
20:48:43.610081 IP lamp-ubuntu-s-1vcpu-1gb-tor1-01.ssh > 162.243.188.66.27289: Flags [P.], seq 17152:17216, ack 1, win 501, options [nop,nop,TS val 1183139451 ecr 612896341], length 64
20:48:43.610119 IP lamp-ubuntu-s-1vcpu-1gb-tor1-01.ssh > 162.243.188.66.27289: Flags [P.], seq 17216:17456, ack 1, win 501, options [nop,nop,TS val 1183139451 ecr 612896341], length 240
20:48:43.610147 IP lamp-ubuntu-s-1vcpu-1gb-tor1-01.ssh > 162.243.188.66.27289: Flags [P.], seq 17456:17520, ack 1, win 501, options [nop,nop,TS val 1183139451 ecr 612896341], length 64
20:48:43.610189 IP lamp-ubuntu-s-1vcpu-1gb-tor1-01.ssh > 162.243.188.66.27289: Flags [P.], seq 17520:17760, ack 1, win 501, options [nop,nop,TS val 1183139451 ecr 612896341], length 240
20:48:43.610233 IP lamp-ubuntu-s-1vcpu-1gb-tor1-01.ssh > 162.243.188.66.27289: Flags [P.], seq 17760:17824, ack 1, win 501, options [nop,nop,TS val 1183139451 ecr 612896341], length 64
20:48:43.610289 IP lamp-ubuntu-s-1vcpu-1gb-tor1-01.ssh > 162.243.188.66.27289: Flags [P.], seq 17824:18064, ack 1, win 501, options [nop,nop,TS val 1183139451 ecr 612896341], length 240
20:48:43.610325 IP lamp-ubuntu-s-1vcpu-1gb-tor1-01.ssh > 162.243.188.66.27289: Flags [P.], seq 18064:18128, ack 1, win 501, options [nop,nop,TS val 1183139451 ecr 612896341], length 64
20:48:43.610377 IP lamp-ubuntu-s-1vcpu-1gb-tor1-01.ssh > 162.243.188.66.27289: Flags [P.], seq 18128:18368, ack 1, win 501, options [nop,nop,TS val 1183139451 ecr 612896341], length 240
20:48:43.610414 IP lamp-ubuntu-s-1vcpu-1gb-tor1-01.ssh > 162.243.188.66.27289: Flags [P.], seq 18368:18432, ack 1, win 501, options [nop,nop,TS val 1183139451 ecr 612896341], length 64
20:48:43.610465 IP lamp-ubuntu-s-1vcpu-1gb-tor1-01.ssh > 162.243.188.66.27289: Flags [P.], seq 18432:18672, ack 1, win 501, options [nop,nop,TS val 1183139451 ecr 612896341], length 240
20:48:43.610504 IP lamp-ubuntu-s-1vcpu-1gb-tor1-01.ssh > 162.243.188.66.27289: Flags [P.], seq 18672:18736, ack 1, win 501, options [nop,nop,TS val 1183139451 ecr 612896341], length 64
20:48:43.610560 IP lamp-ubuntu-s-1vcpu-1gb-tor1-01.ssh > 162.243.188.66.27289: Flags [P.], seq 18736:18976, ack 1, win 501, options [nop,nop,TS val 1183139451 ecr 612896341], length 240
20:48:43.610599 IP lamp-ubuntu-s-1vcpu-1gb-tor1-01.ssh > 162.243.188.66.27289: Flags [P.], seq 18976:19040, ack 1, win 501, options [nop,nop,TS val 1183139451 ecr 612896341], length 64
20:48:43.610656 IP lamp-ubuntu-s-1vcpu-1gb-tor1-01.ssh > 162.243.188.66.27289: Flags [P.], seq 19040:19280, ack 1, win 501, options [nop,nop,TS val 1183139451 ecr 612896341], length 240
20:48:43.610693 IP lamp-ubuntu-s-1vcpu-1gb-tor1-01.ssh > 162.243.188.66.27289: Flags [P.], seq 19280:19344, ack 1, win 501, options [nop,nop,TS val 1183139451 ecr 612896341], length 64
20:48:43.610734 IP lamp-ubuntu-s-1vcpu-1gb-tor1-01.ssh > 162.243.188.66.27289: Flags [P.], seq 19344:19584, ack 1, win 501, options [nop,nop,TS val 1183139452 ecr 612896341], length 240
20:48:43.610761 IP lamp-ubuntu-s-1vcpu-1gb-tor1-01.ssh > 162.243.188.66.27289: Flags [P.], seq 19584:19648, ack 1, win 501, options [nop,nop,TS val 1183139452 ecr 612896341], length 64
20:48:43.610797 IP lamp-ubuntu-s-1vcpu-1gb-tor1-01.ssh > 162.243.188.66.27289: Flags [P.], seq 19648:19888, ack 1, win 501, options [nop,nop,TS val 1183139452 ecr 612896341], length 240
20:48:43.610824 IP lamp-ubuntu-s-1vcpu-1gb-tor1-01.ssh > 162.243.188.66.27289: Flags [P.], seq 19888:19952, ack 1, win 501, options [nop,nop,TS val 1183139452 ecr 612896341], length 64
20:48:43.610861 IP lamp-ubuntu-s-1vcpu-1gb-tor1-01.ssh > 162.243.188.66.27289: Flags [P.], seq 19952:20192, ack 1, win 501, options [nop,nop,TS val 1183139452 ecr 612896341], length 240
20:48:43.610888 IP lamp-ubuntu-s-1vcpu-1gb-tor1-01.ssh > 162.243.188.66.27289: Flags [P.], seq 20192:20256, ack 1, win 501, options [nop,nop,TS val 1183139452 ecr 612896341], length 64
20:48:43.610924 IP lamp-ubuntu-s-1vcpu-1gb-tor1-01.ssh > 162.243.188.66.27289: Flags [P.], seq 20256:20496, ack 1, win 501, options [nop,nop,TS val 1183139452 ecr 612896341], length 240
20:48:43.610951 IP lamp-ubuntu-s-1vcpu-1gb-tor1-01.ssh > 162.243.188.66.27289: Flags [P.], seq 20496:20560, ack 1, win 501, options [nop,nop,TS val 1183139452 ecr 612896341], length 64
20:48:43.611006 IP lamp-ubuntu-s-1vcpu-1gb-tor1-01.ssh > 162.243.188.66.27289: Flags [P.], seq 20560:20800, ack 1, win 501, options [nop,nop,TS val 1183139452 ecr 612896341], length 240
20:48:43.611037 IP lamp-ubuntu-s-1vcpu-1gb-tor1-01.ssh > 162.243.188.66.27289: Flags [P.], seq 20800:20864, ack 1, win 501, options [nop,nop,TS val 1183139452 ecr 612896341], length 64
20:48:43.611080 IP lamp-ubuntu-s-1vcpu-1gb-tor1-01.ssh > 162.243.188.66.27289: Flags [P.], seq 20864:21104, ack 1, win 501, options [nop,nop,TS val 1183139452 ecr 612896341], length 240
20:48:43.611109 IP lamp-ubuntu-s-1vcpu-1gb-tor1-01.ssh > 162.243.188.66.27289: Flags [P.], seq 21104:21168, ack 1, win 501, options [nop,nop,TS val 1183139452 ecr 612896341], length 64
20:48:43.611149 IP lamp-ubuntu-s-1vcpu-1gb-tor1-01.ssh > 162.243.188.66.27289: Flags [P.], seq 21168:21408, ack 1, win 501, options [nop,nop,TS val 1183139452 ecr 612896341], length 240
20:48:43.611179 IP lamp-ubuntu-s-1vcpu-1gb-tor1-01.ssh > 162.243.188.66.27289: Flags [P.], seq 21408:21472, ack 1, win 501, options [nop,nop,TS val 1183139452 ecr 612896341], length 64
20:48:43.611220 IP lamp-ubuntu-s-1vcpu-1gb-tor1-01.ssh > 162.243.188.66.27289: Flags [P.], seq 21472:21712, ack 1, win 501, options [nop,nop,TS val 1183139452 ecr 612896341], length 240
20:48:43.611250 IP lamp-ubuntu-s-1vcpu-1gb-tor1-01.ssh > 162.243.188.66.27289: Flags [P.], seq 21712:21776, ack 1, win 501, options [nop,nop,TS val 1183139452 ecr 612896341], length 64
20:48:43.611290 IP lamp-ubuntu-s-1vcpu-1gb-tor1-01.ssh > 162.243.188.66.27289: Flags [P.], seq 21776:22016, ack 1, win 501, options [nop,nop,TS val 1183139452 ecr 612896341], length 240
20:48:43.611319 IP lamp-ubuntu-s-1vcpu-1gb-tor1-01.ssh > 162.243.188.66.27289: Flags [P.], seq 22016:22080, ack 1, win 501, options [nop,nop,TS val 1183139452 ecr 612896341], length 64
20:48:43.611358 IP lamp-ubuntu-s-1vcpu-1gb-tor1-01.ssh > 162.243.188.66.27289: Flags [P.], seq 22080:22320, ack 1, win 501, options [nop,nop,TS val 1183139452 ecr 612896341], length 240
20:48:43.611388 IP lamp-ubuntu-s-1vcpu-1gb-tor1-01.ssh > 162.243.188.66.27289: Flags [P.], seq 22320:22384, ack 1, win 501, options [nop,nop,TS val 1183139452 ecr 612896341], length 64
20:48:43.611428 IP lamp-ubuntu-s-1vcpu-1gb-tor1-01.ssh > 162.243.188.66.27289: Flags [P.], seq 22384:22624, ack 1, win 501, options [nop,nop,TS val 1183139452 ecr 612896341], length 240
20:48:43.611465 IP lamp-ubuntu-s-1vcpu-1gb-tor1-01.ssh > 162.243.188.66.27289: Flags [P.], seq 22624:22688, ack 1, win 501, options [nop,nop,TS val 1183139452 ecr 612896341], length 64
20:48:43.611517 IP lamp-ubuntu-s-1vcpu-1gb-tor1-01.ssh > 162.243.188.66.27289: Flags [P.], seq 22688:22928, ack 1, win 501, options [nop,nop,TS val 1183139452 ecr 612896341], length 240
20:48:43.611548 IP lamp-ubuntu-s-1vcpu-1gb-tor1-01.ssh > 162.243.188.66.27289: Flags [P.], seq 22928:22992, ack 1, win 501, options [nop,nop,TS val 1183139452 ecr 612896341], length 64
20:48:43.611602 IP lamp-ubuntu-s-1vcpu-1gb-tor1-01.ssh > 162.243.188.66.27289: Flags [P.], seq 22992:23232, ack 1, win 501, options [nop,nop,TS val 1183139452 ecr 612896341], length 240
20:48:43.611662 IP lamp-ubuntu-s-1vcpu-1gb-tor1-01.ssh > 162.243.188.66.27289: Flags [P.], seq 23232:23296, ack 1, win 501, options [nop,nop,TS val 1183139452 ecr 612896341], length 64
20:48:43.611708 IP lamp-ubuntu-s-1vcpu-1gb-tor1-01.ssh > 162.243.188.66.27289: Flags [P.], seq 23296:23536, ack 1, win 501, options [nop,nop,TS val 1183139453 ecr 612896341], length 240
20:48:43.611760 IP lamp-ubuntu-s-1vcpu-1gb-tor1-01.ssh > 162.243.188.66.27289: Flags [P.], seq 23536:23600, ack 1, win 501, options [nop,nop,TS val 1183139453 ecr 612896341], length 64
20:48:43.611778 IP lamp-ubuntu-s-1vcpu-1gb-tor1-01.ssh > 162.243.188.66.27289: Flags [P.], seq 23600:23840, ack 1, win 501, options [nop,nop,TS val 1183139453 ecr 612896341], length 240
20:48:43.611803 IP lamp-ubuntu-s-1vcpu-1gb-tor1-01.ssh > 162.243.188.66.27289: Flags [P.], seq 23840:23904, ack 1, win 501, options [nop,nop,TS val 1183139453 ecr 612896341], length 64
20:48:43.611842 IP lamp-ubuntu-s-1vcpu-1gb-tor1-01.ssh > 162.243.188.66.27289: Flags [P.], seq 23904:24144, ack 1, win 501, options [nop,nop,TS val 1183139453 ecr 612896341], length 240
20:48:43.611870 IP lamp-ubuntu-s-1vcpu-1gb-tor1-01.ssh > 162.243.188.66.27289: Flags [P.], seq 24144:24208, ack 1, win 501, options [nop,nop,TS val 1183139453 ecr 612896341], length 64
20:48:43.611907 IP lamp-ubuntu-s-1vcpu-1gb-tor1-01.ssh > 162.243.188.66.27289: Flags [P.], seq 24208:24448, ack 1, win 501, options [nop,nop,TS val 1183139453 ecr 612896341], length 240
20:48:43.611937 IP lamp-ubuntu-s-1vcpu-1gb-tor1-01.ssh > 162.243.188.66.27289: Flags [P.], seq 24448:24512, ack 1, win 501, options [nop,nop,TS val 1183139453 ecr 612896341], length 64
20:48:43.611974 IP lamp-ubuntu-s-1vcpu-1gb-tor1-01.ssh > 162.243.188.66.27289: Flags [P.], seq 24512:24752, ack 1, win 501, options [nop,nop,TS val 1183139453 ecr 612896341], length 240
20:48:43.612002 IP lamp-ubuntu-s-1vcpu-1gb-tor1-01.ssh > 162.243.188.66.27289: Flags [P.], seq 24752:24816, ack 1, win 501, options [nop,nop,TS val 1183139453 ecr 612896341], length 64
20:48:43.612040 IP lamp-ubuntu-s-1vcpu-1gb-tor1-01.ssh > 162.243.188.66.27289: Flags [P.], seq 24816:25056, ack 1, win 501, options [nop,nop,TS val 1183139453 ecr 612896341], length 240
20:48:43.612066 IP lamp-ubuntu-s-1vcpu-1gb-tor1-01.ssh > 162.243.188.66.27289: Flags [P.], seq 25056:25120, ack 1, win 501, options [nop,nop,TS val 1183139453 ecr 612896341], length 64
20:48:43.612104 IP lamp-ubuntu-s-1vcpu-1gb-tor1-01.ssh > 162.243.188.66.27289: Flags [P.], seq 25120:25360, ack 1, win 501, options [nop,nop,TS val 1183139453 ecr 612896341], length 240
20:48:43.612238 IP lamp-ubuntu-s-1vcpu-1gb-tor1-01.ssh > 162.243.188.66.27289: Flags [P.], seq 25360:25424, ack 1, win 501, options [nop,nop,TS val 1183139453 ecr 612896341], length 64
20:48:43.612295 IP lamp-ubuntu-s-1vcpu-1gb-tor1-01.ssh > 162.243.188.66.27289: Flags [P.], seq 25424:25664, ack 1, win 501, options [nop,nop,TS val 1183139453 ecr 612896341], length 240
20:48:43.612332 IP lamp-ubuntu-s-1vcpu-1gb-tor1-01.ssh > 162.243.188.66.27289: Flags [P.], seq 25664:25728, ack 1, win 501, options [nop,nop,TS val 1183139453 ecr 612896341], length 64
20:48:43.612371 IP lamp-ubuntu-s-1vcpu-1gb-tor1-01.ssh > 162.243.188.66.27289: Flags [P.], seq 25728:25968, ack 1, win 501, options [nop,nop,TS val 1183139453 ecr 612896341], length 240
20:48:43.612419 IP lamp-ubuntu-s-1vcpu-1gb-tor1-01.ssh > 162.243.188.66.27289: Flags [P.], seq 25968:26032, ack 1, win 501, options [nop,nop,TS val 1183139453 ecr 612896341], length 64
20:48:43.612437 IP lamp-ubuntu-s-1vcpu-1gb-tor1-01.ssh > 162.243.188.66.27289: Flags [P.], seq 26032:26272, ack 1, win 501, options [nop,nop,TS val 1183139453 ecr 612896341], length 240
20:48:43.612479 IP lamp-ubuntu-s-1vcpu-1gb-tor1-01.ssh > 162.243.188.66.27289: Flags [P.], seq 26272:26336, ack 1, win 501, options [nop,nop,TS val 1183139453 ecr 612896341], length 64
20:48:43.612516 IP lamp-ubuntu-s-1vcpu-1gb-tor1-01.ssh > 162.243.188.66.27289: Flags [P.], seq 26336:26576, ack 1, win 501, options [nop,nop,TS val 1183139453 ecr 612896341], length 240
20:48:43.612544 IP lamp-ubuntu-s-1vcpu-1gb-tor1-01.ssh > 162.243.188.66.27289: Flags [P.], seq 26576:26640, ack 1, win 501, options [nop,nop,TS val 1183139453 ecr 612896341], length 64
20:48:43.612581 IP lamp-ubuntu-s-1vcpu-1gb-tor1-01.ssh > 162.243.188.66.27289: Flags [P.], seq 26640:26880, ack 1, win 501, options [nop,nop,TS val 1183139453 ecr 612896341], length 240
20:48:43.612608 IP lamp-ubuntu-s-1vcpu-1gb-tor1-01.ssh > 162.243.188.66.27289: Flags [P.], seq 26880:26944, ack 1, win 501, options [nop,nop,TS val 1183139453 ecr 612896341], length 64
20:48:43.612647 IP lamp-ubuntu-s-1vcpu-1gb-tor1-01.ssh > 162.243.188.66.27289: Flags [P.], seq 26944:27184, ack 1, win 501, options [nop,nop,TS val 1183139453 ecr 612896341], length 240
20:48:43.612674 IP lamp-ubuntu-s-1vcpu-1gb-tor1-01.ssh > 162.243.188.66.27289: Flags [P.], seq 27184:27248, ack 1, win 501, options [nop,nop,TS val 1183139453 ecr 612896341], length 64
20:48:43.612727 IP lamp-ubuntu-s-1vcpu-1gb-tor1-01.ssh > 162.243.188.66.27289: Flags [P.], seq 27248:27488, ack 1, win 501, options [nop,nop,TS val 1183139454 ecr 612896341], length 240
20:48:43.612762 IP lamp-ubuntu-s-1vcpu-1gb-tor1-01.ssh > 162.243.188.66.27289: Flags [P.], seq 27488:27552, ack 1, win 501, options [nop,nop,TS val 1183139454 ecr 612896341], length 64
20:48:43.612801 IP lamp-ubuntu-s-1vcpu-1gb-tor1-01.ssh > 162.243.188.66.27289: Flags [P.], seq 27552:27792, ack 1, win 501, options [nop,nop,TS val 1183139454 ecr 612896341], length 240
20:48:43.612828 IP lamp-ubuntu-s-1vcpu-1gb-tor1-01.ssh > 162.243.188.66.27289: Flags [P.], seq 27792:27856, ack 1, win 501, options [nop,nop,TS val 1183139454 ecr 612896341], length 64
20:48:43.612865 IP lamp-ubuntu-s-1vcpu-1gb-tor1-01.ssh > 162.243.188.66.27289: Flags [P.], seq 27856:28096, ack 1, win 501, options [nop,nop,TS val 1183139454 ecr 612896341], length 240
20:48:43.612892 IP lamp-ubuntu-s-1vcpu-1gb-tor1-01.ssh > 162.243.188.66.27289: Flags [P.], seq 28096:28160, ack 1, win 501, options [nop,nop,TS val 1183139454 ecr 612896341], length 64
20:48:43.612940 IP lamp-ubuntu-s-1vcpu-1gb-tor1-01.ssh > 162.243.188.66.27289: Flags [P.], seq 28160:28400, ack 1, win 501, options [nop,nop,TS val 1183139454 ecr 612896341], length 240
20:48:43.612980 IP lamp-ubuntu-s-1vcpu-1gb-tor1-01.ssh > 162.243.188.66.27289: Flags [P.], seq 28400:28464, ack 1, win 501, options [nop,nop,TS val 1183139454 ecr 612896341], length 64
20:48:43.613060 IP lamp-ubuntu-s-1vcpu-1gb-tor1-01.ssh > 162.243.188.66.27289: Flags [P.], seq 28464:28704, ack 1, win 501, options [nop,nop,TS val 1183139454 ecr 612896341], length 240
20:48:43.613099 IP lamp-ubuntu-s-1vcpu-1gb-tor1-01.ssh > 162.243.188.66.27289: Flags [P.], seq 28704:28768, ack 1, win 501, options [nop,nop,TS val 1183139454 ecr 612896341], length 64
20:48:43.613143 IP lamp-ubuntu-s-1vcpu-1gb-tor1-01.ssh > 162.243.188.66.27289: Flags [P.], seq 28768:29008, ack 1, win 501, options [nop,nop,TS val 1183139454 ecr 612896341], length 240
20:48:43.613172 IP lamp-ubuntu-s-1vcpu-1gb-tor1-01.ssh > 162.243.188.66.27289: Flags [P.], seq 29008:29072, ack 1, win 501, options [nop,nop,TS val 1183139454 ecr 612896341], length 64
20:48:43.613209 IP lamp-ubuntu-s-1vcpu-1gb-tor1-01.ssh > 162.243.188.66.27289: Flags [P.], seq 29072:29312, ack 1, win 501, options [nop,nop,TS val 1183139454 ecr 612896341], length 240
20:48:43.613237 IP lamp-ubuntu-s-1vcpu-1gb-tor1-01.ssh > 162.243.188.66.27289: Flags [P.], seq 29312:29376, ack 1, win 501, options [nop,nop,TS val 1183139454 ecr 612896341], length 64
20:48:43.613273 IP lamp-ubuntu-s-1vcpu-1gb-tor1-01.ssh > 162.243.188.66.27289: Flags [P.], seq 29376:29600, ack 1, win 501, options [nop,nop,TS val 1183139454 ecr 612896341], length 224
20:48:43.623338 IP 162.243.188.66.27289 > lamp-ubuntu-s-1vcpu-1gb-tor1-01.ssh: Flags [.], ack 18064, win 4768, options [nop,nop,TS val 612896432 ecr 1183139451], length 0
20:48:43.623396 IP lamp-ubuntu-s-1vcpu-1gb-tor1-01.ssh > 162.243.188.66.27289: Flags [P.], seq 29600:31120, ack 1, win 501, options [nop,nop,TS val 1183139464 ecr 612896432], length 1520
20:48:43.623912 IP 162.243.188.66.27289 > lamp-ubuntu-s-1vcpu-1gb-tor1-01.ssh: Flags [.], ack 19584, win 4768, options [nop,nop,TS val 612896433 ecr 1183139451], length 0
20:48:43.624030 IP 162.243.188.66.27289 > lamp-ubuntu-s-1vcpu-1gb-tor1-01.ssh: Flags [.], ack 21104, win 4768, options [nop,nop,TS val 612896433 ecr 1183139452], length 0
20:48:43.624385 IP 162.243.188.66.27289 > lamp-ubuntu-s-1vcpu-1gb-tor1-01.ssh: Flags [.], ack 22624, win 4768, options [nop,nop,TS val 612896433 ecr 1183139452], length 0
20:48:43.624948 IP 162.243.188.66.27289 > lamp-ubuntu-s-1vcpu-1gb-tor1-01.ssh: Flags [.], ack 24144, win 4768, options [nop,nop,TS val 612896434 ecr 1183139452], length 0
20:48:43.625332 IP 162.243.188.66.27289 > lamp-ubuntu-s-1vcpu-1gb-tor1-01.ssh: Flags [.], ack 25664, win 4768, options [nop,nop,TS val 612896434 ecr 1183139453], length 0
20:48:43.625720 IP 162.243.188.66.27289 > lamp-ubuntu-s-1vcpu-1gb-tor1-01.ssh: Flags [.], ack 27184, win 4768, options [nop,nop,TS val 612896434 ecr 1183139453], length 0
20:48:43.626028 IP 162.243.188.66.27289 > lamp-ubuntu-s-1vcpu-1gb-tor1-01.ssh: Flags [.], ack 28704, win 4768, options [nop,nop,TS val 612896435 ecr 1183139453], length 0
20:48:43.636442 IP 162.243.188.66.27289 > lamp-ubuntu-s-1vcpu-1gb-tor1-01.ssh: Flags [.], ack 31048, win 4768, options [nop,nop,TS val 612896445 ecr 1183139454], length 0
20:48:43.678161 IP 162.243.188.66.27289 > lamp-ubuntu-s-1vcpu-1gb-tor1-01.ssh: Flags [.], ack 31120, win 4768, options [nop,nop,TS val 612896487 ecr 1183139464], length 0
20:48:43.714014 IP lamp-ubuntu-s-1vcpu-1gb-tor1-01.ssh > 162.243.188.66.27289: Flags [P.], seq 31120:31360, ack 1, win 501, options [nop,nop,TS val 1183139555 ecr 612896487], length 240
20:48:43.714105 IP lamp-ubuntu-s-1vcpu-1gb-tor1-01.ssh > 162.243.188.66.27289: Flags [P.], seq 31360:31424, ack 1, win 501, options [nop,nop,TS val 1183139555 ecr 612896487], length 64
20:48:43.714186 IP lamp-ubuntu-s-1vcpu-1gb-tor1-01.ssh > 162.243.188.66.27289: Flags [P.], seq 31424:31664, ack 1, win 501, options [nop,nop,TS val 1183139555 ecr 612896487], length 240
20:48:43.714227 IP lamp-ubuntu-s-1vcpu-1gb-tor1-01.ssh > 162.243.188.66.27289: Flags [P.], seq 31664:31728, ack 1, win 501, options [nop,nop,TS val 1183139555 ecr 612896487], length 64
20:48:43.714281 IP lamp-ubuntu-s-1vcpu-1gb-tor1-01.ssh > 162.243.188.66.27289: Flags [P.], seq 31728:31968, ack 1, win 501, options [nop,nop,TS val 1183139555 ecr 612896487], length 240
20:48:43.714311 IP lamp-ubuntu-s-1vcpu-1gb-tor1-01.ssh > 162.243.188.66.27289: Flags [P.], seq 31968:32032, ack 1, win 501, options [nop,nop,TS val 1183139555 ecr 612896487], length 64
20:48:43.714354 IP lamp-ubuntu-s-1vcpu-1gb-tor1-01.ssh > 162.243.188.66.27289: Flags [P.], seq 32032:32272, ack 1, win 501, options [nop,nop,TS val 1183139555 ecr 612896487], length 240
20:48:43.714384 IP lamp-ubuntu-s-1vcpu-1gb-tor1-01.ssh > 162.243.188.66.27289: Flags [P.], seq 32272:32336, ack 1, win 501, options [nop,nop,TS val 1183139555 ecr 612896487], length 64
20:48:43.714425 IP lamp-ubuntu-s-1vcpu-1gb-tor1-01.ssh > 162.243.188.66.27289: Flags [P.], seq 32336:32576, ack 1, win 501, options [nop,nop,TS val 1183139555 ecr 612896487], length 240
20:48:43.714549 IP lamp-ubuntu-s-1vcpu-1gb-tor1-01.ssh > 162.243.188.66.27289: Flags [P.], seq 32576:33248, ack 1, win 501, options [nop,nop,TS val 1183139555 ecr 612896487], length 672
20:48:43.714569 IP lamp-ubuntu-s-1vcpu-1gb-tor1-01.ssh > 162.243.188.66.27289: Flags [P.], seq 33248:33488, ack 1, win 501, options [nop,nop,TS val 1183139555 ecr 612896487], length 240
20:48:43.714597 IP lamp-ubuntu-s-1vcpu-1gb-tor1-01.ssh > 162.243.188.66.27289: Flags [P.], seq 33488:33552, ack 1, win 501, options [nop,nop,TS val 1183139555 ecr 612896487], length 64
20:48:43.714637 IP lamp-ubuntu-s-1vcpu-1gb-tor1-01.ssh > 162.243.188.66.27289: Flags [P.], seq 33552:33792, ack 1, win 501, options [nop,nop,TS val 1183139555 ecr 612896487], length 240
20:48:43.714680 IP lamp-ubuntu-s-1vcpu-1gb-tor1-01.ssh > 162.243.188.66.27289: Flags [P.], seq 33792:33856, ack 1, win 501, options [nop,nop,TS val 1183139555 ecr 612896487], length 64
20:48:43.714734 IP lamp-ubuntu-s-1vcpu-1gb-tor1-01.ssh > 162.243.188.66.27289: Flags [P.], seq 33856:34096, ack 1, win 501, options [nop,nop,TS val 1183139556 ecr 612896487], length 240
20:48:43.714764 IP lamp-ubuntu-s-1vcpu-1gb-tor1-01.ssh > 162.243.188.66.27289: Flags [P.], seq 34096:34160, ack 1, win 501, options [nop,nop,TS val 1183139556 ecr 612896487], length 64
20:48:43.714802 IP lamp-ubuntu-s-1vcpu-1gb-tor1-01.ssh > 162.243.188.66.27289: Flags [P.], seq 34160:34400, ack 1, win 501, options [nop,nop,TS val 1183139556 ecr 612896487], length 240
20:48:43.714831 IP lamp-ubuntu-s-1vcpu-1gb-tor1-01.ssh > 162.243.188.66.27289: Flags [P.], seq 34400:34464, ack 1, win 501, options [nop,nop,TS val 1183139556 ecr 612896487], length 64
20:48:43.714872 IP lamp-ubuntu-s-1vcpu-1gb-tor1-01.ssh > 162.243.188.66.27289: Flags [P.], seq 34464:34704, ack 1, win 501, options [nop,nop,TS val 1183139556 ecr 612896487], length 240
